review_id,rating,review
ChZDSUhNMG9nS0VJQ0FnSUNoNV9hQlJBEAE,3,"Lokasi bagus di pusat kota.

Makanan resto kurang enak dan menarik, terutama di bagian nasi dkk. Untuk buah, … Lainnya"
ChZDSUhNMG9nS0VJQ0FnTUN3cHI3WEJREAE,5,"makananya enakkk sekali tersedia banyak varian juga disini , tempatnya nyaman ademKamar: 5… Lainnya"
ChdDSUhNMG9nS0VJQ0FnSUNPdUlLcjBnRRAB,5,"Pas mau kasi review, nggk sengaja baca review
org lain yg ada kendala dan masalah dengan kamar / makanan / proses check in dll, saya sendiri pertama kali ke Jogja karna ada Tugas dinas. … Lainnya"
ChdDSUhNMG9nS0VJQ0FnSUNyXzZUenhRRRAB,2,"Mungkin masukan untuk Customer service bagian reservasi lewat telepon ( 12 juli 2024 sekitar jam 17.00 untuk Jawaban atas pernyataan yaitu kita telpon untuk menanyakan harga kamar permalam,harga kamar start from 500rb sedangkan di telpon … Lainnya"
Ci9DQUlRQUNvZENodHljRjlvT2twR1dFOVdOMHc0ZG5OMVkxQkRTR1JaWkhndFJrRRAB,5,Sarapan paginya cukup enakKamar: 5… Lainnya
ChdDSUhNMG9nS0VJQ0FnSUNyczRQcDdnRRAB,4,"Pelayanan baik, menu sarapan kurang bervariasi, lokasi strategis hanya jalan didepan hotel sering macet Lainnya"
Ci9DQUlRQUNvZENodHljRjlvT21wcFNHbzVjRGQzTjNScmVVTjFZalZHV1d4T09XYxAB,5,nyamann .rekomended juga untuk makananyaKamar: 4… Lainnya
ChdDSUhNMG9nS0VJQ0FnSURQLWN2M2hRRRAB,4,"Stay di sini karena ada kebutuhan pekerjaan, staff nya ramah-ramah dan bikin betah, Saya senang ngobrol dengan staff-staff nya Terima kasih juga mbak, Rosvina atas bantuan dan pelayanan nya yang luar biasa excellent service 👍👍👍👍 … Lainnya"
ChZDSUhNMG9nS0VJQ0FnSUNiOGZlZ2ZREAE,1,"Mohon untuk wc di area parkir basemant di perhatikan.
Sangat sangat sangat tidak layak di pakai,
- Kloset banyak kotoran m****** … Lainnya"
ChdDSUhNMG9nS0VJQ0FnTUN3a3JTYmdBRRAB,5,"Hotel terbaikkk,kamarnya nyaman, pelayanannya bagus, makanannya enak, dan juga fasilitas lengkap. Top deh Lainnya"
ChZDSUhNMG9nS0VJQ0FnSURCMGVHSFhBEAE,2,"saya menginap tgl 21 - 23 Januari 2023.
kesan dihari pertama sudah kecewa :
1. Saya pesan kamar dg kasur Double King Size tapi yg dikasi ternyata kasur twin … Lainnya"
ChZDSUhNMG9nS0VJQ0FnTURJOWRQS0JBEAE,5,"Staff ramah, kamar luas & nyaman, makanan di restonya enak.Kamar: 5… Lainnya"
ChdDSUhNMG9nS0VJQ0FnTURnbzdTQjl3RRAB,4,"Hotel nyaman, pelayanan baik, makanan enak dan banyak pilihan lokasi dekat kemana2.Kamar: 4… Lainnya"
ChZDSUhNMG9nS0VJQ0FnTUNBbXFUdGRnEAE,5,"Hotel yang cocok buat staycation, kamarnya luas bersih. Breakfastnya juga enakk pelayanannya top👍🏻👍🏻👍🏻 … Lainnya"
ChZDSUhNMG9nS0VJQ0FnSURCdXZyaFZ3EAE,5,"Kelebihan:
1. Meeting fullboard dg harga paling murah sekelas bintang 5.
Ruang meeting nya banyak,bangunannya megah. … Lainnya"
ChZDSUhNMG9nS0VJQ0FnTUR3a2NET0VnEAE,4,"Pengalaman menginap disana seru, lokasinya strategis dkt sama mall, serta fasilitas umum lainnya.Jen… Lainnya"
ChdDSUhNMG9nS0VJQ0FnSUMxaDkyWWd3RRAB,5,"Bersih dan nyaman, pelayanan juga ramah dan baik meski ada waiters yang kurang baik respon dan pelayanannya. Saya minta air panas sewaktu breakfast tapi cuman di iyain aja sampe makanan saya habis akhirnya minta sama waiters yang lain baru di anterin dan akhirnya di sediakan air panas di outlet minuman 😌 … Lainnya"
ChdDSUhNMG9nS0VJQ0FnSUNYNEllcXNnRRAB,5,"kamarnya baguss dan keren, pelayanannya juga memuaskan. apalgi dekat dengan malioboro, mall. kren deh hotelnya, menginap di sini ga bakal bikin rugi Lainnya"
ChZDSUhNMG9nS0VJQ0FnTUN3c09LR1FBEAE,5,"Penginapan yang sangat rekomendasi banget , fasilitas, kebersihan nya terjaga banget, next ngajak temen temen untuk nginep disini 🤩 … Lainnya"
ChdDSUhNMG9nS0VJQ0FnSUMydzh2M2tBRRAB,4,"Hallo semuanya...
Ini review perdana ku di Hotel Grand Mercure Yogyakarta dalam rangka memenuhi undangan. … Lainnya"
Ci9DQUlRQUNvZENodHljRjlvT21sTWNWSkhUMnBYVlVSU1Z6bG5iV1Z4VkZneFNFRRAB,5,Makanannya bervariasi dan enak👍👍 …Jenis perjalananLiburan… Lainnya
ChdDSUhNMG9nS0VJQ0FnSUNMckpUUDRRRRAB,4,Pas waktu menginap disini kebetulan dpt kamar yg ada balkon nya tp view nya tembok 😑 Sarapanya jg B aja pdhl hotel Bintang 5 🤔 … Lainnya
ChZDSUhNMG9nS0VJQ0FnSUR2dE82N0lREAE,5,"Semua makanannya enak, beragam banyak pilihan🥰 pelayanan ramah, fasilitas oke bangetttt …Kamar:… Lainnya"
ChZDSUhNMG9nS0VLbmRwTl90OE9HNk53EAE,5,"Pelayanannya bagus, kamar dan sarapannya juga puas ☺Jenis perjalananBi… Lainnya"
ChdDSUhNMG9nS0VJQ0FnSURUNTRfcW9nRRAB,5,"Sebelumnya pernah menginap di mercure surabaya & pontianak, dibanding kedua hotel tsb. menurut saya utk sisi rasa pada menu breakfast mercure yogya kurang nendang, alhasil 3 kali breakfast mengambil menu yg sama, yaitu gudeg 😁, lebih karena … Lainnya"
ChZDSUhNMG9nS0VJQ0FnTURnZ3FmNlNREAE,5,"Hotelnya mewah bersih dan rapih pelayanannya bagus, pengen balik lagi pokonyaa mantapJenis perjalana… Lainnya"
ChdDSUhNMG9nS0VJQ0FnSUNlcGFDSTdRRRAB,5,"Long weekend kmrin keJogja sma keluarga, late co dihotel karna kami keprambanan dlu.bgtu smpe hotel agak kerepotan krna koper bnyak tapi staff sigap langsung bantuain pdhal lobby ramai org karna mmg musim liburan kali ya, kami dpt kamar … Lainnya"
ChdDSUhNMG9nS0VJQ0FnTURRMEtpUTJ3RRAB,5,"Makananya enak
Ramah2 stafnya
Dan membantu memberikan suprise sama suami ku yg ultahKamar: 4… Lainnya"
ChZDSUhNMG9nS0VJQ0FnTUN3c3VQb053EAE,5,"Pelayanan yang sangat bagus, tempat ternyaman, makanannya pun enak enak, recomended gess👍 …Jenis perj… Lainnya"
Ci9DQUlRQUNvZENodHljRjlvT25sYVZGSmFPWGRXWVV0NlYwSkxTMHQyV1ZCRVRVRRAB,5,makanannya enak bgt servicenha juga okeeKamar: 5… Lainnya
ChZDSUhNMG9nS0VJQ0FnTURRNnJXaVBnEAE,5,Pelayanan mantabs..kamar bersih...makanan luar biasa....menyenangkan..pertahankanKamar: 5… Lainnya
ChZDSUhNMG9nS0VJQ0FnSURqaEpLQUZ3EAE,5,"Sangat puas atas segala fasilitas & pelayanan hotelnya suasana kamar dan suasana hotelnya ckp menarik, pelayanan nya pun sangat ramah dari mulai check-in hingga check out, mohon selalu terus ditingkatkan Lainnya"
ChdDSUhNMG9nS0VJQ0FnSUM5Z0ppN3R3RRAB,4,"lokasi strategis, sarapan enak banyak pilihan, banyak menu makanan jogja nyaa. lift nya cepet kd kalau baru2 bisa cepet saat kegiatan di hotel ini Lainnya"
ChdDSUhNMG9nS0VJQ0FnTURRcF95am9BRRAB,5,"Lokasi strategis, kamar bagus. Pelayanan staf hotel baik dan ramah.Jenis perjalanan… Lainnya"
ChdDSUhNMG9nS0VJQ0FnTURveElQeGxBRRAB,5,"Lokasi cukup jauh dari bandara, jadi harus take time. Untuk layanan dan kamar sudah sempurna.Jenis p… Lainnya"
ChdDSUhNMG9nS0VJQ0FnSUNwMFBpR3pnRRAB,5,"Saya menginap 3 malam di Grand Mercure Yogyakarta. So far pelayanan hotel
Memuaskan, kamar bersih, amenities lengkap. Untuk resto makanannya enak, sarapan lengkap dari makanan traditional, western tersedia. … Lainnya"
ChZDSUhNMG9nS0VJQ0FnSUMzNUxETlpREAE,5,"Hotelnya sangat nyaman, rapi dan bersih. Seluruh pegawai nya juga ramah2, saat datang disambut dengan sangat baik. Lainnya"
ChZDSUhNMG9nS0VJQ0FnSUREOGVpUlNREAE,5,"Pelayanan sangat baik dan sesuai SOP, kamar sangat bagusss !!!! Konsepnya romantis dan cocok buat pasangan. makanan enak dan mungkin perlu bebebrapa inovasi dalam makanan. Terima kasih Lainnya"
ChdDSUhNMG9nS0VJQ0FnTURvMHE2cDN3RRAB,5,Makanan enak dan banyak variasi dan untuk pelayanan memuaskan ramah serta sopanKamar: 5… Lainnya
ChZDSUhNMG9nS0VJQ0FnSURmOWRLdGV3EAE,4,"Untuk breakfast Nasi gudegnya kurang, dan ayam tepung tulangnya masih merah, untuk yg lainnya lumayan Lainnya"
ChZDSUhNMG9nS0VJQ0FnSUM3bWZpOUNnEAE,5,"Pelayanan sangat baik, pegawainya ramha menawarkan pelayanan makanan dan sangat profesional.. terbaik pokoknya sangat direkomendasikan menginap disini Lainnya"
ChRDSUhNMG9nS0VJQ0FnSUNIcFlCYRAB,5,"bagus dari pelayanan, room, staff, sampai makanannya
rekomend banget buat liburanJenis perjalanan… Lainnya"
ChdDSUhNMG9nS0VJQ0FnTURnbHZpZXVRRRAB,5,Semua pelayanan top markotop atas nama mba Silka markotop kasih reward bagus untuk tim management nya ya . Terima kasih
ChdDSUhNMG9nS0VJQ0FnSURKMmNpSTlRRRAB,5,"Hotel mendukung masalah lingkungan dengan tidak menyajikan air kemasan botol plastik. Hotelnya cantik dengan ornamen candi, kamar bagus, ada welcome fruit yang cukup banyak. Makanan biasa sih, menyajikan banyak menu tradisional. Snack acara rapatnya enak dan cukup generous. Amenities nya juga lengkap. Lainnya"
ChdDSUhNMG9nS0VJQ0FnTUNJb05qdTFnRRAB,5,"Pelayanannya cukup baik, makanannya enak,  varian makananya banyakJenis perjalanan… Lainnya"
ChZDSUhNMG9nS0VJQ0FnSURQbk1HdEdnEAE,5,"Secara keseluruhan utk makanan enaak.. kecuali krecek terlalu oily, encer.. hotel bagus t4 strategis Lainnya"
ChZDSUhNMG9nS0VJQ0FnSUR2dWNXRk5BEAE,5,Sarapan paginya sangat enak grand Mercure saya sering menginap disini. Terimakasih mba fifin untuk pelayanan nya 👍👍 … Lainnya
ChdDSUhNMG9nS0VJQ0FnSUQtaHJhajB3RRAB,3,"Saya punya harapan besar dengan hotel ini. Kamar yg saya pilih pun di atas rata-rata. View gunung. Saya pesan via Ag**a.
Waktu sampai di hotel kaget, karena ada rombongan karyawan kantor yg akan rapat … Lainnya"
ChdDSUhNMG9nS0VNaTVyY2pWNVliajJRRRAB,5,Pelayanan ramah..makanan jg enak.tempat nyamanKamar: 5… Lainnya
ChdDSUhNMG9nS0VJQ0FnSUMzZ295RHpBRRAB,5,"Pelayanan di restoran sangat memuaskan, makanan dan minuman cukup lengkap dengan rasa yang enak.Kamar:… Lainnya"
ChZDSUhNMG9nS0VJQ0FnTUNJb05mZk13EAE,5,"Makanan untuk bukber nya enak,ragamnya bervariasi,banyak macam yang bisa dipilihKamar: 5… Lainnya"
ChdDSUhNMG9nS0VJQ0FnSURKdjZXeXJnRRAB,3,"Saya menginap di Ibis Laksda Adi Sucipto untuk 1 malam. Lobby hotel agak tersembunyi di samping, apabila membawa driver atau sewa mobil tidak masalah. Proses check inn cepat, kamar cukup nyaman dengan tersedia bantal dan guling. Namun … Lainnya"
ChdDSUhNMG9nS0VJQ0FnSUR4aHZYVThnRRAB,4,"Overall rekomended, untuk kamarnya saya suka karena bagus dan estetik tapi ada kerusakan sedikit di pintu showernya … Lainnya"
ChdDSUhNMG9nS0VJQ0FnTURBdzlQVGxRRRAB,5,"All the best terutama waitress kak silkia  di grand mercure yogya adisucipto pelayanannya the best, ramah dan sigap dalam pelayanannya. Lainnya"
ChdDSUhNMG9nS0VJQ0FnSUQtc3VQMmp3RRAB,3,"pengalaman nginap di Grand Mercure tgl 23 november 2022 lumayan baik tapii ada tapinya sih, untuk hotel sekelas bintang 5 saya berekspektasi fasilitas kamar mendapat smart tv, tapi ternyata belum tersedia. dan sayang nya parkir untuk tamu … Lainnya"
ChdDSUhNMG9nS0VJQ0FnSURQLWVXSnV3RRAB,5,"Pelayanan baik, rasa masakan enak, sarannya menu tiap harinya bisa lebih variatifKamar: 5… Lainnya"
ChdDSUhNMG9nS0VJQ0FnSUNkajlQMG1BRRAB,5,"Kamar nya bersih rapih. Ga terlalu besar tapi nyaman.
Pelayanannya ramah dari resepsionis sampai yg di ruang makan dan tempat rapat.
Lokasinya stategis dekat stasiun dan dekat mall.
Suasananya enak ga berisik Lainnya"
ChZDSUhNMG9nS0VJQ0FnSURyNE9qell3EAE,5,"Enak menu restorannya, tapi kamarnya mungkin perlu revisi ulang agar tambah bagus dan bersih dan lampu penerangan kurang terang Lainnya"
ChdDSUhNMG9nS0VJQ0FnTURneXZiYnFnRRAB,5,"Pelatanan di sini sangat luarbiasa…staf nya ramah-ramah… makanannya enak, kamarnya bersih…😍😍😍 …Kamar:… Lainnya"
ChZDSUhNMG9nS0VJQ0FnSURMM1BHVk1REAE,5,"Kedua kalinya menginap Hotel Grand Mercure Yogyakarta Adisucipto dengan sangat nyaman. Kamar sangat bersih dan rapih, untuk restonya menyedikan banyak pilihan makanan dan semuanya enak 😊 … Lainnya"
ChdDSUhNMG9nS0VJQ0FnSUNENnR6eWl3RRAB,1,"Service parah, saat iftar, piring membludak petigas malah senyum lalu pada kabur kaburan ngambilin piring. Receptionist hotel juga ngeselin gak bisa bantu early checking padahal sudah request jauh jauh hari bisa. Penyampaiannya pun gak  mengenakkan hati . Lainnya"
ChdDSUhNMG9nS0VJQ0FnSURGc3BITy13RRAB,5,"Perfect place to stay. Breakfastnya excellent. Mulai dr berbagai macam yg namanya bread, donat, kue tradisional, masakan tradisional, masakan kekinian ada. Rasanya juara. Fasilitas ok. … Lainnya"
ChdDSUhNMG9nS0VJQ0FnTUN3aTRQSm1BRRAB,5,"staffnya ramah & membantu, pelayanan sangat bagus, Iftar di sini jadi moment yg nyaman dan spesialKamar:… Lainnya"
ChZDSUhNMG9nS0VJQ0FnSUQtbHI2S0xREAE,5,"Menginap dan bermalam di sini tidak rugi, fasilitasnya lengkap kolam renang ada,gym ada,restaurant ada outdornya di lantai atas, di kamar juga ada pengering rambut. Kamarnya  juga  rapi, bersih. Kamar madi bersih.pas Mandi pakai air panas sambil nyanyi nyani.. serasa sedang konser musik.pertahankan keberisihannya.mantap Lainnya"
ChdDSUhNMG9nS0VJQ0FnSUN1c0tpNHNBRRAB,5,"Saya liburan sama keluarga 2 anak usia 8th dan 5th, masih bisa pakai kamar dengan tipe Executive Room King Bed, luas 37 m²/398 ft². Ada sofa bed yg bisa dipakai, kalaupun extra bed masih muat karena kamarnya luas. Ada bathtub juga meski … Lainnya"
ChZDSUhNMG9nS0VJQ0FnSUNoalkyaEZBEAE,3,"Nginep disini jangan berekspektasi seperti hotel bintang 5 lainya
1. Dapet view tembok. Bayar mahal hanya untuk liat tembok, sedih si rasanya
2. Stok tisu di kamar ngga ada … Lainnya"
ChZDSUhNMG9nS0VJQ0FnSUREc2Vuc1pnEAE,5,"Suka dengan semuanya karena berada di lokasi yang strategis, pelayanan ramah & cepat, kondisi kamar yg selalu bersih.
Eksten sampai 3x karena masih betah... … Lainnya"
ChdDSUhNMG9nS0VJQ0FnTUN3aHRUUTN3RRAB,5,"sangat baik pelayanannya, work it sihh, kalau untuk bukber bersama keluargaKamar: 5… Lainnya"
ChdDSUhNMG9nS0VJQ0FnSURUZ2E2UHFnRRAB,2,"D saat ramai lift mati hanya 1 yang nyala dan menjadi numpuk d lobby. Nunggu lift sangat lama.
Amanitis kamar nya minta tolong d cek lagi. Kalau cutton bud jangan yg tipis dan … Lainnya"
ChdDSUhNMG9nS0VJQ0FnSURYaXFPN3lRRRAB,5,"Pelayanan Restoran sangat baik dan ramah. Makanannya juga enak khususnya menu khas tradisional, jajanan lainnya juga enak. Lainnya"
ChZDSUhNMG9nS0VJQ0FnSUMtX3B5a1RnEAE,1,"Selamat malam

Dear management grand mercure hotel yogyakarta. … Lainnya"
ChZDSUhNMG9nS0VJQ0FnSUM5dFBqUGRnEAE,5,"Pelayanannya ramah Skali, kami ditawari kopibatau minuman lain. Telur dadarnya enak karena ada temannya sosis. Ruangan restonya dingin nyaman ya. Over all sip Skali. Salut! Lainnya"
ChdDSUhNMG9nS0VJQ0FnSUNUc0x2WXdBRRAB,5,"Ramah baru sampai langsung dijemput barang bawaan diantar sampai kamar ' omnya baek2 tulus gak mau dikasih tips
Makan pagi enak ' malamnya ada caffe didekat loby ada bilyard ,piano dan papan catur ada kolam renang dilantai 8'  reccomanded ✅️"
ChdDSUhNMG9nS0VJQ0FnSURVX2F1QXBnRRAB,3,"Makanan enak, layanan bagus, kamar bau rokok, mgkn sblmnya ada yg merokok, internet di kamar lambat banget, TV ga jernih, kabur bintik². Lainnya"
ChdDSUhNMG9nS0VJQ0FnSUMtbzRtbG5RRRAB,5,"Hotel bintang 5 yang memiliki desain stylish dan elegan, dan letaknya strategis di jalan adi sucipto, Sleman ini memiliki gedung 8 lantai, dan menyediakan 305 kamar mulai dari King hingga standar room.  Selain itu di sini juga tersedia 13 … Lainnya"
Ci9DQUlRQUNvZENodHljRjlvT25aallqRjZUWEZVWmxsS1JEWlhjbWh3WjIxM04wRRAB,5,"Devita . Pelayanan bagus ,ramah .  Profesional ..Jenis perjalananBisni… Lainnya"
ChZDSUhNMG9nS0VJQ0FnSURGNW91SEhnEAE,5,"Hotel bersih dan makanannya lumayan bervariasi, enak-enak... Kalau bisa ditambahkan fasilitas minimarket agar para pelanggan diberikan kemudahan jika ada keperluan mendadak, misal obat2an, pembalut wanita, dll... Sukses selalu grand mercure hotel Lainnya"
ChZDSUhNMG9nS0VJQ0FnSURSamEzWlpBEAE,4,"Kondisi kamar bersih, nyaman untuk istirahat tapi AC gk bisa dikecilin terlalu dingin. … Lainnya"
ChdDSUhNMG9nS0VJQ0FnSUNycE9PMzZRRRAB,5,Sarapannya enak dan ada menu tradisional (traning lena)Kamar: 5… Lainnya
ChZDSUhNMG9nS0VJQ0FnSURqd2VhUFV3EAE,5,Kamar luas dan bersih sarapan enak  banyak pilihan semua staf hotel ramah lokasi hotel dekat pusat perbelanjaan klo ke jogja pasti nginap lagi disini Lainnya
ChdDSUhNMG9nS0VJQ0FnSUNfdTctNXN3RRAB,5,"Pelayanan ramah dan tanggap.
Selalu bersih dan rapi.
Rekomen banget bagi yg liburan ke Jogja dan bingung mau menginap dimana. Lainnya"
ChdDSUhNMG9nS0VJQ0FnSUROOF9tNXN3RRAB,2,"Parkiran motor tidak aman, padahal berada di dalam gedung. Uang recehan saya yg buanyaak hampir penuh di dasbor motor habis tak bersisa dicuri semua. Motor teman jg dibuka joknya, jd tau krn joknya mmg susah nutupnya. Lainnya"
ChdDSUhNMG9nS0VJQ0FnSUNid3U3NzB3RRAB,5,"Utk kamar cukup memuaskan, pelayanan Ok. Makanan juga sangat variatif dengan rasa yg memuaskanKamar:… Lainnya"
ChZDSUhNMG9nS0VJQ0FnSUQ3NDdTTE5REAE,4,Sarapannya enak namun telurnya sebaiknya dibuat Dan disimpan di stock agar orang tidak menunggu pembuatan telur yg lama. Tksh Lainnya
ChdDSUhNMG9nS0VJQ0FnSUMza2ZMVC1nRRAB,5,"Lokasi strategis, varian masakan OK, ambience resto keren, view bagus...wajib kesini lagiJenis perja… Lainnya"
ChZDSUhNMG9nS0VJQ0FnSURteWNxRVdBEAE,5,"Pertama kali menginap di hotel ini kesannya memuaskan. Berada di lokasi yang strategis di kota Jogja, dekat dengan Ambarukmo Plaza. Pelayanan ramah, proses checkin dan check out sangat cepat. Untuk kamar, bersih, modern dan nyaman. Utk … Lainnya"
ChZDSUhNMG9nS0VJQ0FnSUNqazlmRkVREAE,5,"Kamarnya Nyaman dan bersih,, cocok banged buat kalian yang jalan-jalan ke Jogja,,
Makanannya juga enakk... 🥰🥰 … Lainnya"
ChdDSUhNMG9nS0VJQ0FnSURQM2EzRXFBRRAB,5,Kamar sangat bagus utk sarapan enak2 banyak pilihan bisa dijadikan referensi buat liburan ke jogjaJe… Lainnya
Ci9DQUlRQUNvZENodHljRjlvT21OSmVHWlpURVZyUlZsdFFXazFSbWQwVUUxQ01XYxAB,5,breakfastnya okee👍👍 …
ChdDSUhNMG9nS0VJQ0FnTURndzVmZHBRRRAB,5,"tmpatnya nyaman, strategis juga karena di pusat kota. betah disini gamau cepet pulang hihiii"
Ci9DQUlRQUNvZENodHljRjlvT20wM2RVVlpWek00Wm1KS2IzSmlWbWx2U1RKYWFIYxAB,5,kamar bersih resepsionis ramahKamar: 5… Lainnya
ChZDSUhNMG9nS0VJQ0FnSURqeGR6Y05nEAE,5,"Makanan (ikan tepung) agak keras..minuman tidak menyediakan kopi saat diner, buah melon tidak manis..untuk lainnya bagus dan enak ..pelayanan bagus dan ramah Lainnya"
Ci9DQUlRQUNvZENodHljRjlvT2t4V2NWOVdTVFZpYjFGelRrcEhRVkp0U1hCNFkyYxAB,5,Pelayanan sangat bagusKamar: 5Layanan:… Lainnya
ChdDSUhNMG9nS0VJQ0FnSUNqdnRXZjd3RRAB,5,"Kesini untuk acara BPIP, Fasilitas hotel lengkap dan kondisinya masih sangat bagus, untuk makanannya enak, pelayanan prima sigap dan cekatan kalau habis selesai makan langsung di ambil dan juga ramah. Lainnya"
ChZDSUhNMG9nS0VJQ0FnSUNucE8zNk9REAE,5,"Hotelnya sangat menyenangkan, dekat dengan pusat kota, kamarnya bersih, sajian di restoran enak, menu juga bervariasi... Lainnya"
ChZDSUhNMG9nS0VJQ0FnSURobHFtTUhREAE,4,"Makanan enak dan sangat beragam (indonesian), termasuk cappuccino dan minuman tradisional. Untuk infrastruktur agak tua (lift berbunyi). Tapi yang cukup mengganggu adalah kulkas dikamar juga berbunyi,seperti bunyi jangkrik malam hari, … Lainnya"
ChZDSUhNMG9nS0VJQ0FnSURUX3AybGVnEAE,1,"Dari 4 lift yang ada, hanya 1 yang beroperasi, di long weekend, bobrok banget managementnya, gaada persiapan mateng bgt ngadepin long weekend, bayar mahal2 cuman buat nunggu lift, sekelas mercure lohh"
ChdDSUhNMG9nS0VJQ0FnSUQ3d2Z6azdnRRAB,5,Tempatnya strategis. Interiornya juga bagus. Ada unsur jawa yang membuat menarik. Kamar nyaman. Makanan juga enak. Recommended kalau ke jogja. Lainnya
ChdDSUhNMG9nS0VJQ0FnSURoMHQyNzNBRRAB,4,"Untuk standar hotel bintang 5 masih kurang sih. Kebersihan kamar perlu ditingkatkan.
Lokasi enak, dekat dgn RS Siloam kalo ada kerabat yg dirawat di sana. … Lainnya"
ChdDSUhNMG9nS0VJQ0FnSUNOaDdtMnNRRRAB,4,"Tadi sempat ada masalah dgn pemindahan kamar, basically krn info dr panitia kurang maksimal, tp saya merasa dr pihak hotel juga agak kurang maksimal dlm assisting their guests. Lainnya"
ChdDSUhNMG9nS0VJQ0FnSURCaUx5aGhRRRAB,4,"Kesekian kali berkunjung kesini dan mulai semakin Ok. Terima kasih untuk FOM Bu Fitri beserta tim dan FBM P Iqram beserta tim, yang sudah banyak membantu dari awal saya CI to CO (3-6 Januari 2023). Meski dikunjungan saya kali ini tidak … Lainnya"
ChdDSUhNMG9nS0VJQ0FnSUQ1d2FYZWdBRRAB,5,"Menginap 3D2N. Lokasi strategis, kamar tamu yang luas dibandingkan hotel bintang sejenis, meski perlu ada peremajaan karena kesan tua masih terlihat. Staf hotel ramah, mulai front liner petugas di restoran, hingga housekeeper. Recommended. Lainnya"
ChZDSUhNMG9nS0VJQ0FnSUQzNjlEU0RREAE,5,Kamar bersih. Pelayanan baik. Makanan lengkap. Bukan pertama kali menginap disini. Selalu puas.Jenis… Lainnya
ChdDSUhNMG9nS0VJQ0FnSUM5MVotVC13RRAB,4,"Pelayanan cukup memuaskan, tetapi untuk tmtp sarapanya terallu tinggi di lt 8 jd malas orng untuk naik klw bs sarapan di lantai loby biar sxan cek out Lainnya"
ChZDSUhNMG9nS0VJQ0FnSUNicTdLVmVnEAE,5,"Enak banget nginep di sini! Posisi dekat kemana-mana, strategis. Pelayanan juga baik. Sarapan sih, enak hehehehe. 4 hari yang menyenangkan selama di Jogja 🫶🏽 … Lainnya"
ChdDSUhNMG9nS0VJQ0FnSUNoejhHVm1RRRAB,3,"3 malam menginap disini, overall sudah cukup baik. Namun yang perlu menjadi perhatian adalah kualitas WiFi di dalam kamar, karena kurang proporsional dan sulit connect. Kemudian jet shower ternyata ketika setelah dipakai flush, tidak bisa … Lainnya"
Ci9DQUlRQUNvZENodHljRjlvT2xoMFRtVmxiVlZZV1dOSFFYaDJMV0p2UVRkQlJuYxAB,5,"Sangat nyaman , dan tempat yang sangat strategisJenis perjalananLibura… Lainnya"
ChZDSUhNMG9nS0VJQ0FnSURMM1BHTFlBEAE,5,Bagus tempat nya tp sangat disayangkan restoran nyadi lantai 8 biasanya yg lain di lt 1 atau lobby tp tidak mengecewakan makanannya Lainnya
ChdDSUhNMG9nS0VJQ0FnTURJdHVPOHNRRRAB,5,"hotel dgn fasilitas lengkap dan pelayanan ramah dari para staffnya, rekomendasi topp bagi yang cari hotel di jogja Lainnya"
ChZDSUhNMG9nS0VJQ0FnSURYdDVtbUdBEAE,5,"Hotelnya nyaman. Servicenya ramah, kamar bersih dan rapih. Menu sarapannya variatif dan enak GoodKamar:… Lainnya"
ChdDSUhNMG9nS0VJQ0FnTUN3alpxVm93RRAB,5,Makanan nya enak pelayanan mba andin trainee sangat ramah baik dan cantikkKamar: 5… Lainnya
Ci9DQUlRQUNvZENodHljRjlvT2twNGFHNXBhbTVXYWxsNU56Rk5RVmxOTTA5bWQzYxAB,5,"Makanan nya enak, dan pelayanan nya bagusKamar: 5… Lainnya"
ChdDSUhNMG9nS0VJQ0FnTUNBbkpXUWlRRRAB,5,"Alamat hotel strategis tepat dengan kota dan mall, kamar nyaman, pelayanan cukup ramah, makanannya juga enak enak Lainnya"
ChdDSUhNMG9nS0VJQ0FnSUQxazV1VnNBRRAB,5,"Pelayanan hotel, fasilitas, restoran, dll semuanya sangat memuaskan dan bagus. Next time pasti akan kesini lagi sih Lainnya"
ChdDSUhNMG9nS0VJQ0FnSURWLTlqVzRnRRAB,5,"Hotel yg dekat dengan bandara adi sucipto yogyakarta. Dari dalam kamar atau restonya bisa melihat view gunung merapi bila kondisi cerah. Fasilitasnya pun lengkap, ada tpat gym dan kolam renang, cuma lebih lengkap kalau ada kolam jacuzzi … Lainnya"
ChZDSUhNMG9nS0VJQ0FnTUN3cHE2aE1REAE,5,"Sangattt rekomended untuk kesini, makanannya enak, staff dan pelayanan sangat baikKamar: 5… Lainnya"
ChdDSUhNMG9nS0VJQ0FnSUNkMDdpdjRBRRAB,5,"Pelayanan nya ramah, sesuai dengan kota nya. Ademmmm... Saya senang dan berharap bisa ke sini lagi. Fasilitas hotel sangat lengkap. Terima kasih Lainnya"
ChZDSUhNMG9nS0VJQ0FnSUNicS1uMGFREAE,5,"Pelayanannya bagus, untuk breakfast mungkin bisa lebih bervariasi, uniknya gosok giginya sangat behel friendly suka bangettt Lainnya"
ChZDSUhNMG9nS0VJQ0FnSUM3bVl1WlBnEAE,5,"Alhamdulillah luar biasa makanan, layanan . Paket complet deh pokoknya. Recomendeed banget nih hotel Lainnya"
ChdDSUhNMG9nS0VJQ0FnSUNQOEs2LTV3RRAB,5,"Pelayanan yang sangat memuaskan dan hotelnya sangat bersih, Berbagai hidangan yang berbeda beda setiap harinya Lainnya"
ChdDSUhNMG9nS0VJQ0FnSUN2dk9DaGtBRRAB,4,Menu sarapan dan penyajian bagus. Lokasi sarapan bagus krn bisa melihat gunung Merapi. Kebersihan area sarapan bagus. Pelayanan bagus. Lainnya
ChdDSUhNMG9nS0VJQ0FnSUQ5Z19ld2t3RRAB,4,"Lokasi hotel strategis. Beberapa kali diundang acara di hotel ini, sempat beberapa kali juga memilih hotel mercure untuk acara hasilnya selalu memuaskan pelayanan baik didukung dengan staf yang ramah. Terima kasih Grand Mercure Yogyakarta Lainnya"
ChdDSUhNMG9nS0VJQ0FnSUNUNTVqSTRBRRAB,5,"Ruangannya nyaman, sarapannya enak, pelayanan bagus, lokasi juga strategis dekat dengan berbagai fasilitas umum. So far, I like being there Lainnya"
ChdDSUhNMG9nS0VJQ0FnSUNqc05pTm9RRRAB,5,"Overall experiencenya memuaskan, breakfast variatif dan kamar spacey dan bersih. khusus balkon kalau mau buka pintunya by request ke resepsionis ya. Lainnya"
ChdDSUhNMG9nS0VJQ0FnSUNEMl9QOHpRRRAB,5,"Menu sarapan nya sangat lengkap, rasa nya juga enak
Saya datang di jam 9 tapi semua makanan masih banyak. Staff nya juga sangat membantu Lainnya"
ChZDSUhNMG9nS0VJQ0FnSUR2aHViNUl3EAE,5,"Hotel dan pelayanan nya baik, makanan nya bervariasi, enak,. Terimakasih untuk mbak Salma 😘 …Kamar:… Lainnya"
ChZDSUhNMG9nS0VJQ0FnSUNIelBuMU53EAE,5,"makanannya enak, kamarnya nyaman ada gulingnya, dan dekat kota
seneng banget sama pelayanannya~~Kamar:… Lainnya"
ChZDSUhNMG9nS0VJQ0FnSUR4OS11bUJnEAE,5,"Menginap 2 malam di sini cukup nyaman, lokasi di dekat pusat kota dan twraedia banyak fasikitas publik di sekitar hotel.
Untuk fasilitas hotel lengkap terutama tersedia kolam renang bagi anak-anak dan tempat makan terbuka yang nyaman. Lainnya"
ChdDSUhNMG9nS0VJQ0FnSUR2dFBDNmtBRRAB,5,"Salah satu opsi hotel terbaik di Yogyakarta, terletak dipinggir jalan Adisucipto lokasinya cukup strategis. Kamar cukup nyaman. Lainnya"
ChZDSUhNMG9nS0VJQ0FnSUNoM2JDMFZ3EAE,5,"Sarapan dengan menu yang variasi sangat baik untuk tamu

Alangkah baiknya untuk sofa di sediakan 2-3 yg free sisanya baru u tuk reservasi … Lainnya"
ChdDSUhNMG9nS0VJQ0FnSUQ3ejhTMDFnRRAB,1,"saya hanya seorang driver ,apa salah standby dan jajan dikantin yg memang dikususkan untuk karyawan katanya,kita jajan juga byr,dr pada hrus keluar jauh,dan ada beberapa oknum yg tdk ramah !! Lainnya"
ChZDSUhNMG9nS0VJQ0FnSURSeHBHT1hnEAE,3,"Awal mula saya memilih grang mercure jogya, karena saya berpikiran akan sama dengan seperti grand mercure yg di Malang dan Solo. Tapi ternyata sangaat beda jauh. Pertama pemesana n kamar tidak sesuai dengan yg saya pesan. Bed dipesanan saya … Lainnya"
Ci9DQUlRQUNvZENodHljRjlvT2paTVlXVjVNMjlxUVVSR1FtNVpTa2hFWVdsZlUwRRAB,5,Pelayanannya memuaskanKamar: 5Layanan:… Lainnya
