review_id,rating,review
ChZDSUhNMG9nS0VJQ0FnTUNBMDVIR2RREAE,5,"Pengalaman menginap di sini selama 3 malam sangat menyenangkan. Hotelnya cukup unik, karena Ibis dan Grand Mercure berada dalam satu gedung. Jadi, saya memesan kamar di Ibis, tetapi saya mendapatkan setengah dari pengalaman menginap di … Lainnya"
ChZDSUhNMG9nS0VJQ0FnSUNfcGJqT1FnEAE,5,"Sebagai anggota Accor Hotels, saya memesan hotel Mercure di Jakarta dan negara-negara lain pada umumnya. Di sini saya menginap 2 malam di Grand Mercure, Yogyakarta. Pertama, hotel ini sangat indah dan didekorasi dengan apik, memberikan … Baca ulasan lainnya di Trip.com"
ChZDSUhNMG9nS0VJQ0FnTURJOVpyd2ZREAE,5,"Kamarnya bagus, sangat luas untuk ukuran kamar deluxe. Gelas dan botol airnya sangat minim, kami hanya mendapatkan 2 gelas dan 2 botol air. … Lainnya"
ChZDSUhNMG9nS0VJQ0FnTUNZNXIyN1FBEAE,5,"Hotel yang nyaman, klasik, dan mewah. Terletak di kawasan komersial Jogja yang strategis. Hotel ini menawarkan kemudahan menginap dan akses mudah ke seluruh penjuru kota Jogja 🏙️ … Lainnya"
ChdDSUhNMG9nS0VJQ0FnSURfOU1PTjNnRRAB,5,"Hotel & layanan yang luar biasa!!! Menginap yang sangat menyenangkan, SELALU!
Kami datang ke Yogyakarta setiap tahun dan selalu menginap di hotel ini. Stafnya selalu sangat ramah dan kamarnya sangat bersih. Kolam renangnya luar biasa, … Lainnya"
ChZDSUhNMG9nS0VJQ0FnSUM3bXFpM1pREAE,5,Pelayanannya sangat baik. Saya datang lebih awal pukul 5.00 pagi karena kereta saya tiba pukul 4.00 pagi. Stafnya sangat membantu. Mereka menerima bagasi saya karena saya ingin berkeliling Yogyakarta. Saya bisa menitipkan bagasi dan sore … Lainnya
ChdDSUhNMG9nS0VJQ0FnSUM5bUt2dG5nRRAB,5,"Dengan fasilitas yang lengkap dan kolam renang yang menawan, hotel ini menawarkan keseimbangan sempurna antara kenyamanan dan kemewahan. Kamar-kamarnya yang luas dan elegan dilengkapi dengan fasilitas modern, memastikan tamu merasa nyaman … Lainnya"
ChdDSUhNMG9nS0VJQ0FnSUQ5MVlPMWxRRRAB,5,Senang sekali menginap di sini. Suasana dan dekorasinya (bertema Borobudur) membuat pengalaman menginap semakin menyenangkan. Menginap selama 3 malam dan menu makan malamnya menyajikan makanan dari berbagai negara di setiap malamnya (poin menarik✨). Kamarnya selalu bersih dan sungguh layak untuk dicoba sekali seumur hidup. Lainnya
ChZDSUhNMG9nS0VJQ0FnSUR2OC11Y09BEAE,5,"Alhamdulillah dan ini pendapat saya tentang makanan dll.
Dan semuanya enak dan sesuai dengan selera saya.
Pokoknya yang terbaik untuk hotel Mercure. Lainnya"
ChdDSUhNMG9nS0VJYkx5SjJhaUxxZXBnRRAB,5,"Saya datang ke sini untuk acara perpisahan dan tempatnya sangat bagus. Pelayanannya sangat baik dan makanannya, terutama dagingnya, sangat lezat. Bagus sekali 😁 … Lainnya"
Ci9DQUlRQUNvZENodHljRjlvT2pWb2IzUXhTRzVxYWtSbGFtTkllbTVqY2pkaVZIYxAB,5,"Lokasi bagus, penginapan nyaman, proses check-in dan check-out mudah, staf ramah mulai dari resepsionis hingga staf sarapan. Lainnya"
ChZDSUhNMG9nS0VJQ0FnSURmX29iSlBBEAE,5,Hotel yang nyaman untuk menginap bersama keluarga. Semua menu sarapannya enak dan beragam. Saya dan keluarga sangat senang menginap di Grand Mercure Yogyakarta. Terima kasih 🤩🙌 … Lainnya
ChdDSUhNMG9nS0VJQ0FnSURkOWZuYnR3RRAB,5,"Saya suka ruangannya yang tenang. Semua varian menu sarapannya juga enak. Meskipun agak berlebihan ditawari kopi lebih dari sekali, saya mengerti keramahannya, dan membuat semua pengalaman di pagi hari menjadi lebih baik. Lainnya"
ChZDSUhNMG9nS0VPZnM0N1N2bDRfdFhREAE,5,Kamar yang bagus dan makanan yang lezat. Saya bersenang-senang menginap di hotel ini.Kamar: 5… Lainnya
ChZDSUhNMG9nS0VJQ0FnSUN6bTdpeldREAE,5,"Pelayanannya bagus, sangat nyaman. Baru saja masuk, tempat parkirnya terlalu sempit. Earphone nirkabel saya tertinggal di bawah tempat tidur, dan layanan pelanggan tetap menyimpannya dan mengirimkannya ke tempat saya. Dalam beberapa hari, earphone akan sampai. Terima kasih. Lainnya"
ChZDSUhNMG9nS0VJQ0FnSURyakpTbGZ3EAE,5,"Ini bukan pertama kalinya saya menginap di sini.
Selalu senang untuk kembali.
Mereka mengirim pesan melalui WhatsApp sebelum tanggal check-in. Tanyakan apa … Lainnya"
ChZDSUhNMG9nS0VJQ0FnSURUeTVTSU1nEAE,5,"Kamar yang cukup menyenangkan untuk beristirahat, sangat cocok jika Anda ingin menginap sebentar bersama teman atau orang yang Anda cintai. Secara keseluruhan kamarnya bersih dan bagus, tidak ada yang perlu ditulis di rumah, itu bagus! Lainnya"
ChdDSUhNMG9nS0VJQ0FnSUNSMHR6WHNRRRAB,5,"Saya baru-baru ini menginap di Hotel Mercure di Yogyakarta dan secara keseluruhan, saya mendapatkan pengalaman yang luar biasa. Pusat kebugarannya merupakan fitur unggulan, dengan peralatan yang memadai dan pelatih yang sangat membantu yang … Lainnya"
ChZDSUhNMG9nS0VJQ0FnSUNUNV9pRUZREAE,5,"Tempat ini bagus mengingat lokasinya di tengah kota, dan juga dekat dengan rekomendasi kuliner favorit. … Lainnya"
ChZDSUhNMG9nS0VJQ0FnTURJeWNUaU1BEAE,5,"menginap di sini untuk perjalanan bisnis, kamarnya bersih, fasilitasnya bagus, dan sarapan prasmanannya enak dan berlimpah. Pelayanan bagus juga Lainnya"
ChZDSUhNMG9nS0VJQ0FnSUNYNV9YdVh3EAE,5,"Hotel ini sangat bagus dan terletak di lokasi yang sangat mudah diakses.
Makanan di sini jauh di atas ekspektasi saya dibandingkan standar hotel.
Stafnya sangat ramah dan rendah hati, khas keramahan alami penduduk lokal Jogja. Lainnya"
ChZDSUhNMG9nS0VJQ0FnSUNyakxIdVVREAE,5,"-Kamarnya bagus.
-Staf dan pelayanannya baik.
-Pilihan sarapannya lumayan. Kamar perlu ditingkatkan. … Lainnya"
ChdDSUhNMG9nS0VJQ0FnSUNSazZtMHdBRRAB,5,"Lokasinya mudah diakses. Berada di pusat kota. Makanannya lezat dan banyak pilihan. Kamarnya juga wangi, tetapi ada sedikit noda di seprai dan dinding, terutama di toilet. Pelayanannya sangat baik dan hangat. Terima kasih. Lainnya"
ChdDSUhNMG9nS0VJQ0FnSUR6dHV2Q3dRRRAB,5,Saya menginap dua malam saat menjelajahi Jojo... pengalamannya luar biasa... kamar hotelnya indah dan stafnya fantastis. … Lainnya
ChdDSUhNMG9nS0VJQ0FnSUNILVBpcWxRRRAB,5,"Hotel ini sangat mudah diakses dari jalan utama, dan juga memiliki kamar yang luas. Saya sarapan gudeg yang enak.
Terdapat banyak Kafe dan Restoran di dekat hotel. Saya mendapatkan pengalaman menginap yang menyenangkan! Lainnya"
ChdDSUhNMG9nS0VJQ0FnSUM0b1pUUHJnRRAB,5,"Senang sekali menginap di sini, stafnya sangat ramah dan kami selalu meminta rekomendasi mie goreng jawa. Mereka membantu kami dengan tulus dan bertanya apakah kami akan mencobanya saat kembali ke hotel. Pengalaman menginap yang sangat … Lainnya"
ChdDSUhNMG9nS0VJQ0FnSURCbW9hZmxRRRAB,5,"Saya sudah beberapa kali ke sana setiap kali mengunjungi negara asal saya. Siapa yang tidak akan menyukai hotel ini? Terletak di area yang tepat (Pusat Pariwisata, Komersial, dan Kuliner) sehingga Anda dapat menikmati Yogyakarta tanpa … Lainnya"
ChdDSUhNMG9nS0VJQ0FnSUR2dklMaHBnRRAB,5,"Sarapannya lengkap, segar, dan banyak variannya. Dari makanan lokal hingga sarapan Amerika dan kontinental. Stafnya sangat membantu, terutama terima kasih kepada Diana, yang telah memberikan yang terbaik sepanjang hari. Lainnya"
ChZDSUhNMG9nS0VJQ0FnSURyNElDMkFnEAE,5,"Kamar sangat bagus dan nyaman, sarapan beragam dan semuanya enak.

Terima kasih Grand Mercure Yogyakarta atas pengalaman menginap yang luar biasa di hotel ini… Lainnya"
ChdDSUhNMG9nS0VJQ0FnSURrZ2RxX3J3RRAB,5,"Kami mendapatkan ""kamar bebas rokok"" di lantai 7, dan bau asap rokok langsung tercium sejak kami membuka lift dan berjalan melewati koridor. Kami meminta kamar baru, dan kami mendapatkannya di lantai 6, dan suasananya benar-benar … Lainnya"
ChdDSUhNMG9nS0VJQ0FnSUNicTl2ZjdBRRAB,5,"Saya suka makanan yang mereka sajikan, dan layanan kamar mereka juga yang terbaik. Saya suka lokasinya, tapi sejujurnya pemandangannya di bawah ekspektasi saya, tapi tidak masalah. Lainnya"
ChZDSUhNMG9nS0VJQ0FnSURqaG9qRmJnEAE,5,"Terima kasih kepada Ihrom, Manajer FB, dan timnya yang telah membuat masa inap kami semakin menyenangkan dengan mengizinkan kami menggunakan benefit AccorPlus kami, dan kepada Fauzan, trainee yang ramah dan selalu ceria, ramah, serta akomodatif kepada para tamu. Salut dan teruslah berkarya! Lainnya"
ChZDSUhNMG9nS0VJQ0FnSURSNnFYUldnEAE,5,"Saya sudah beberapa kali ke sana dan selalu terpesona dengan pelayanan dan kamarnya. Sarapannya luar biasa dengan berbagai macam pilihan makanan. Kolam renangnya lumayan. Perlu sedikit perbaikan, tetapi secara keseluruhan semuanya bagus. Luar biasa!"
ChdDSUhNMG9nS0VJQ0FnSUM0bU0ydzJnRRAB,5,"Pertama-tama, kamar hotelnya bagus dan nyaman, langsung dingin, terkadang mereka memberi Anda barang gratis, toiletnya sangat bersih, dan Anda bisa mendapatkan beberapa utilitas gratis. Fasilitasnya luar biasa! Pusat kebugarannya memiliki … Lainnya"
ChdDSUhNMG9nS0VJQ0FnTURJamFqU2h3RRAB,5,"Menunya enak dan pelayanannya juga baik, untuk yang mau ke jogja sangat direkomendasikan untuk menginap di hotel ini Lainnya"
ChZDSUhNMG9nS0VJQ0FnSURONUlqbU5nEAE,5,Hotel yang baru dibangun ini menawarkan fasilitas berkualitas tinggi. Lokasinya mudah diakses dari bandara (sekitar 15 menit naik taksi) dan pusat kota juga berjarak sekitar 15 menit naik taksi (tersedia juga layanan antar-jemput gratis … Baca ulasan lainnya di Tripadvisor
ChZDSUhNMG9nS0VJQ0FnSUNjOWZ6S0RBEAE,5,"Secara pribadi, desain interiornya tidak terlalu berbeda antara tipe kamar. Tapi saya lebih mementingkan kenyamanan tidur daripada estetika (meskipun saya suka estetika). Tempat tidurnya sangat nyaman, suasananya nyaman, dan saya suka … Lainnya"
ChdDSUhNMG9nS0VJQ0FnTUNZZ0lMNXhRRRAB,5,"Mereka memberikan kejutan ulang tahun yang menyenangkan untuk istri saya, datang ke kamar dengan kue, lilin, dan bernyanyi.||Lokasi dan pelayanan bagus."
ChdDSUhNMG9nS0VJQ0FnSURwc1o3ODBnRRAB,5,"Makanan di restorannya cukup enak. Lezat dan banyak variasi makanan di sana, mulai dari makanan tradisional hingga makanan lainnya. Pelayanannya cukup baik 👍 … Lainnya"
ChdDSUhNMG9nS0VJQ0FnSURKaVpPLV93RRAB,5,"Perjalanan ke Yogyakarta ini singkat namun sangat menyenangkan, berkat Grand Mercure Yogyakarta. Biasanya saya menginap di hotel Accor lain di Yogyakarta, tetapi kali ini saya memilih untuk mencoba menginap di Grand Mercure. … Lainnya"
ChdDSUhNMG9nS0VJQ0FnSURSNWZEUF9RRRAB,5,"Sebagai salah satu hotel Accor, tak heran jika makanannya lezat. Patut ditegaskan kembali betapa istimewanya. Semuanya dimasak dengan sempurna dan dibumbui dengan tepat. Kamar-kamarnya luas dan hotelnya sendiri sangat menawan. Lainnya"
ChdDSUhNMG9nS0VJQ0FnTUNnN1B2TWdnRRAB,5,"Kamar bersih, staf ramah dan membantu, terutama Ibu Intan (saat sarapan selama saya menginap satu minggu) Lainnya"
ChdDSUhNMG9nS0VJQ0FnSUNYOG9PRjFBRRAB,5,"Sarapannya enak, rasanya luar biasa, meskipun menurut saya agak berlebihan. Meskipun begitu, pelayanannya bintang 5! Lainnya"
ChZDSUhNMG9nS0VPVHYxN21SZ01YdUhnEAE,5,Tempat yang bagus untuk dikunjungi dan menginap. Tempatnya nyaman dan pelayanannya baik.Jenis perjal… Lainnya
ChdDSUhNMG9nS0VJQ0FnSURKNXV6cGdRRRAB,5,"Kami sedang dalam perjalanan bisnis di dekat hotel, sekitar 1 kilometer. Desain hotel ini merupakan perpaduan antara kamar modern dengan seni dan aksesori budaya lokal. Saya menginap di kamar superior, dan kami memiliki cukup ruang untuk … Lainnya"
ChZDSUhNMG9nS0VJQ0FnSUNHbnFuRlFnEAE,5,"Hotel yang bagus dengan beberapa tempat indah di Yogyakarta. Saya menginap di kamar yang luas dan bersih dengan fasilitas lengkap. Makanannya bervariasi, mulai dari Barat hingga tradisional. Semuanya terasa lezat, kecuali buburnya yang … Lainnya"
ChdDSUhNMG9nS0VJQ0FnTURBdjVtUzNnRRAB,5,Tempat menginap yang bagus. Saya sedang dalam perjalanan bisnis dan menginap di sini. Kamarnya bagus dan pelayanan stafnya sangat baik. Lainnya
ChZDSUhNMG9nS0VJQ0FnSUNGd0lPN0lBEAE,5,"Saya ingin menyampaikan apresiasi yang tulus kepada tim Grand Mercure dan iBis. Beberapa masalah kecil yang saya sebutkan bertujuan untuk kenyamanan tamu di masa mendatang. Yang paling berkesan adalah dedikasi tim Anda, yang meninggalkan … Lainnya"
ChZDSUhNMG9nS0VJQ0FnSUNuNnJLQVVBEAE,5,Pelayannya lezat dan menunya sesuai selera Anda. Dan pelayannya: Bunga romantis dan ramah kepada pelanggan. Terima kasih. Lainnya
ChdDSUhNMG9nS0VJQ0FnSUNuc1l1aWt3RRAB,5,"Fasilitas hotelnya sangat bagus, kamarnya sendiri luas, bersih, dan dirancang elegan, dengan semua fasilitas modern yang dibutuhkan. Lainnya"
ChZDSUhNMG9nS0VJQ0FnSUR4aHVXdGN3EAE,5,"Kamar lumayan luas dan makanan bervariasi, staf ramah dan gercep, super ramah untuk Denov, dia sangat membantu dan informatif, Terima kasih banyak. Kolam renangnya bagus.  Pasti akan menginap di sini lagi suatu hari nanti. Lainnya"
ChdDSUhNMG9nS0VJQ0FnSURUX2YtWXFRRRAB,5,"Suasananya sangat nyaman, kamarnya luas dan bersih.
Menu sarapannya bervariasi dengan beberapa hidangan khas Indonesia. Lainnya"
ChZDSUhNMG9nS0VJQ0FnSUNnNzZTa0R3EAE,5,"Tempat menginap yang bagus di Yogyakarta. Hotel baru di kota ini dengan interior tradisional autentik dan kenyamanan modern. Stafnya ramah dan membantu.
Kamarnya bersih dan nyaman. … Lainnya"
ChdDSUhNMG9nS0VJQ0FnSURidU1lODh3RRAB,5,"Saya selalu senang sarapan di Mercure. Menu dan minumannya beragam. Saya terutama menyukai oatmeal, keju, dan yoghurt. Di Jogja, saya menikmati ""jajanan pasar"" terutama ""bubur ketan hitam"". Saya juga menyukai keramahannya. Lainnya"
Ci9DQUlRQUNvZENodHljRjlvT2tWWmNXZHpVa015T1ZWUFYyeDFlVlI0VkUxWWNIYxAB,5,Semua makanannya enak... 👍👍👍 …Kamar: 5… Lainnya
ChZDSUhNMG9nS0VJQ0FnSUNoalluVFpBEAE,5,"Semua staf ramah, kamarnya sangat nyaman. Semua fasilitasnya bagus.
Untuk sarapan, menu yang disajikan sangat lengkap.
Menurut selera saya, saya kurang puas dengan pastanya (terlalu asin, perlu sedikit garam dan lada). Hotelnya bagus dengan akses yang mudah."
ChZDSUhNMG9nS0VJQ0FnSURoaVAyMUxnEAE,5,"Kamarnya bagus dan bersih. Hotel ini juga mendukung keberlanjutan lingkungan, jadi itu poin bagus. Pusat kebugarannya bagus, dengan pelatih yang sangat suportif. Stafnya juga sangat ramah. Saya tidur nyenyak di sini. Sangat direkomendasikan. Lainnya"
ChZDSUhNMG9nS0VJQ0FnSUNwcjQzUmRREAE,5,"Hotel nyaman di lokasi strategis, dikelilingi pusat bisnis dan perbelanjaan. Lokasinya juga dekat dengan rumah sakit, sehingga saya tetap tenang jika sakit atau terjadi kecelakaan tak terduga. Mereka menyajikan makanan lezat dan layanan dari staf yang ramah. Lainnya"
ChdDSUhNMG9nS0VJQ0FnSURSMmVtY3hRRRAB,5,Menginap semalam saat liburan ke Yogyakarta. Hotel ini merupakan salah satu hotel bintang lima terbaik dengan nuansa Jawa dan candi. Kamar-kamarnya nyaman dan dilengkapi furnitur mewah. Semua stafnya sangat ramah. Makanannya beragam dan … Lainnya
ChdDSUhNMG9nS0VJQ0FnSUNqdnJubnRnRRAB,5,"Pelayanan yang diberikan sangat baik, mulai dari staf yang ramah dan sangat membantu ketika pelanggan mengalami kesulitan. Makanan yang disajikan juga lezat dan sehat. Terima kasih Grand Mercure. Tingkatkan kualitas dan pelayanannya. ✨ Lainnya"
ChZDSUhNMG9nS0VJQ0FnSUNXby1xVUJREAE,5,"Hotel yang bagus untuk menginap, direkomendasikan bagi mereka yang mencari tempat strategis.
Kamar bersih, staf yang ramah, supir yang membantu, dan layanan laundry yang … Lainnya"
ChZDSUhNMG9nS0VJQ0FnSUNuOE55MlJnEAE,5,"Kamarnya sangat bagus dengan pelayanan yang luar biasa. Sarapannya luar biasa dan stafnya sangat ramah. Jangan lupa juga, hotel ini terletak di pusat kota Jogja. Lainnya"
ChdDSUhNMG9nS0VJQ0FnSUNudTdYYW9nRRAB,5,"Kamar mandi adalah hal terpenting dalam ulasan saya. Ada sesuatu tentang pengalaman mandi di sana yang tak tertandingi, tentu saja dalam arti yang baik. Saya bisa menghabiskan seharian di dalam kamar mandi. Lainnya"
ChdDSUhNMG9nS0VJQ0FnSUR3MHFTWDNBRRAB,5,"Instagramable.... interiornya keren... perpaduan elemen tradisional dalam warna dan desain modern... tak lupa ""rekor dunia"" untuk hotel dengan gambar Borobudur paling tematik... sungguh. Lokasinya strategis, layanan makan terbaik, fasilitas … Lainnya"
ChdDSUhNMG9nS0VJQ0FnSUR4aDh6YXRBRRAB,5,"Pelayanan dan kualitas menu untuk sarapan sangat baik dan bervariasi, pelayanan staf juga ramah dan baik. Sangat direkomendasikan untuk tempat pertemuan dan liburan keluarga dengan lokasi yang sangat strategis di tengah kota Yogyakarta Lainnya"
ChZDSUhNMG9nS0VJQ0FnSURvMzRhNU9REAE,5,"Hotel bintang 5 terbaik di Yogyakarta

Semua staf sangat ramah dan menyambut. Kamarnya luas dan nyaman. Makanannya … Lainnya"
ChZDSUhNMG9nS0VJQ0FnSUNlOGJlb09BEAE,5,"Gunakan Accor Plus untuk memesan dengan jaminan harga lebih rendah. Hotelnya secara keseluruhan luar biasa, lokasinya bagus, kami bahkan bisa bersepeda ke Malioboro. Kamarnya luas, tapi saya kurang suka dengan kamar mandinya yang terpasang … Lainnya"
ChdDSUhNMG9nS0VJQ0FnSURueGNfNHhBRRAB,5,Tempat menginap yang bagus dan bersih dengan staf yang ramah dan sangat membantuKamar: 5… Lainnya
ChZDSUhNMG9nS0VJQ0FnSURSODc2MGZ3EAE,5,Baru saja menginap di sana saat libur Lebaran 2023.. Pastinya salah satu hotel terbaik untuk menginap bersama keluarga setiap kali Anda mengunjungi Jogjakarta.. … Lainnya
ChZDSUhNMG9nS0VJQ0FnSUNfc2I3SEVREAE,5,Tempatnya bagus. Makanannya enak. Banyak variasi. Layak untuk menginap.Kamar: 5… Lainnya
ChdDSUhNMG9nS0VJQ0FnTUNZa3VtTzNRRRAB,5,Semua pelayanan yang baik dan luar biasa hanya kursi di kamar yang perlu dihilangkan.Kamar: 4… Lainnya
ChdDSUhNMG9nS0VJQ0FnSURlcE9pQnFRRRAB,5,"Pengalaman saya menginap dua hari di Grand Mercure sangat menyenangkan!

Lokasi & Bangunan … Lainnya"
ChZDSUhNMG9nS0VJQ0FnSURZczlTTUpBEAE,5,"Tempat menginap yang nyaman untuk liburan bersama keluarga. Arsitekturnya luar biasa. Anda akan melihat pemandangan indah saat memasuki lobi. Unsur seni terasa di dalamnya. Cocok untuk bulan madu atau makan malam bersama pasangan, terutama … Lainnya"
ChZDSUhNMG9nS0VJQ0FnSURJX2ZTLVhnEAE,5,"Hotelnya sangat luas. Kamu bahkan bisa bermain bisbol di dalamnya, yang bagus untukku karena aku fobia ruangan sempit.
Makanannya enak, lezat! Sungguh. Dan stafnya sangat ramah dan menyambut.
Ingin kembali lagi!"
ChdDSUhNMG9nS0VJQ0FnSURJaGVDZW13RRAB,5,"Ini akan menjadi tempat favorit saya untuk ""staycation"". Segala sesuatu tentang hotel ini sangat baik bagi saya. Ada mini market dan beberapa pusat perbelanjaan di dekatnya. Mereka memiliki kamar dan fasilitas yang bagus, serta pelayanan … Lainnya"
ChZDSUhNMG9nS0VJQ0FnSURqdEpxM0VnEAE,5,"Tempat menginap yang bagus.
Kamarnya bernuansa luar biasa, sarapannya beragam, dan stafnya sangat ramah.
Hotel yang direkomendasikan. Lainnya"
ChdDSUhNMG9nS0VJQ0FnTURJall5N3d3RRAB,5,"Kamar dan kamar mandinya bersih....dan sarapannya luar biasa.
Wajib menginap di hotel ini.Jenis perj… Lainnya"
ChdDSUhNMG9nS0VJQ0FnSUNYeWVyTXJBRRAB,5,"Bersih, pelayanan prima, sarapan enak, pelayan baik dan sopan..
Bintang 5 dech🙂 …Jenis perjalanan… Lainnya"
ChdDSUhNMG9nS0VJQ0FnSURYdVBHeW9BRRAB,5,Seperti biasa..mercure memberikan saya pengalaman yang luar biasa saat saya menginap..kamarnya cukup nyaman..sarapannya enak dan bervariasi..stafnya ramah dan membantu..thx mercure Lainnya
ChZDSUhNMG9nS0VJQ0FnSURnbjkzM1RREAE,5,"Sungguh mengejutkan mendapatkan merchandise untuk anggota loyalitas Accor dari manajemen hotel ini. Saya sangat mengapresiasi tim kreatif hotel untuk wayang Punakawan yang terbuat dari kaca berlapis perak, dan terlebih lagi foto keluarga … Lainnya"
ChZDSUhNMG9nS0VJQ0FnSUM1MGYtdWFnEAE,5,"Tempatnya sangat bagus, stafnya sangat ramah dan mereka bisa membantu Anda dengan segala hal. Makanannya lezat dan pelayanannya luar biasa. Kamarnya bersih dan lokasinya sangat bagus. Lainnya"
ChdDSUhNMG9nS0VJQ0FnSUNRNF9uZWh3RRAB,5,"Sangat direkomendasikan.
Hotelnya bersih dan dikelola dengan baik.
Saya menginap di hotel ini selama 3 hari 2 malam, perlengkapan mandinya diisi … Lainnya"
ChZDSUhNMG9nS0VJQ0FnSUNldy0tT2ZBEAE,5,"Keren banget!!! Interiornya keren banget! Seluruh areanya juga bersih, dan staf serta pelayannya ramah banget. Parkirannya juga luas, jadi gampang banget buat parkir kendaraan yang kita bawa. Lainnya"
ChdDSUhNMG9nS0VJQ0FnSURaLTVIbXFBRRAB,5,"Hotel yang luar biasa dan sarapan prasmanan terbaik yang pernah saya rasakan. Stafnya sangat ramah, terutama Nona Rara dan Tuan Bawa yang sangat ramah! Lainnya"
ChdDSUhNMG9nS0VJQ0FnTURReWM2VnVBRRAB,5,"Tempatnya bagus banget, pengalamannya menyenangkan, stafnya ramah dan baik, bakal balik lagi kesini lain kali Lainnya"
ChdDSUhNMG9nS0VJQ0FnSUNIc2E2cmlRRRAB,5,"Kamarnya nyaman dan sangat nyaman sampai tidur nyenyak.
Sarapannya juga lezat dengan makanan dan minuman yang disajikan dengan sangat baik oleh Ibu Kika. Lainnya"
ChZDSUhNMG9nS0VJQ0FnSUNWeVBhbWJBEAE,5,"Selalu puas dengan pelayanannya, ketika kehilangan hp di toilet umum langsung lapor ke pihak hotel, hp langsung ketemu, terus pas meeting kalau ada perlengkapan yang saya butuhkan pihak hotel cepat melengkapinya, pelayanannya mantap 👍👍👍 … Lainnya"
ChdDSUhNMG9nS0VJQ0FnSUNfeW9mSjNBRRAB,5,"secara keseluruhan tentang kamar dan semua makanan di resto bagus, dan pelayanannya juga bagus 👍🏽👍🏽 … Lainnya"
ChdDSUhNMG9nS0VJQ0FnSUM1d2VLRmtRRRAB,5,Hotel yang terawat baik dengan kolam renang yang indah dan sarapan yang luar biasa. Stafnya penuh perhatian dan kamarnya nyaman. Harganya terjangkau. Lainnya
ChZDSUhNMG9nS0VJQ0FnSUNCeW9EOUdnEAE,5,"Pengalaman menginap yang menyenangkan dengan keramahan yang baik. Sarapannya bervariasi, terkadang ramai, tapi tetap oke. Kamar bersih dan tempat tidurnya nyaman. Pasti akan kembali! Lainnya"
ChZDSUhNMG9nS0VJQ0FnSURaMnVHckxREAE,5,"Beberapa masakannya terlalu asin, ikannya masih agak amis tapi sisanya oke, banyak varian makanannya.
Terima kasih"
ChdDSUhNMG9nS0VJQ0FnSURJejR1MmdRRRAB,5,"Terletak di pinggir jalan utama di Yogyakarta, hanya 10 menit dari Bandara Adisutjipto dengan berkendara sedang. Suasananya oke, kamarnya nyaman, dan kedap suara juga baik. Saya sangat mengapresiasi staf mereka yang ramah dan hangat. Kerja bagus!"
ChdDSUhNMG9nS0VJQ0FnSUNIOV91Y2dnRRAB,5,Pengalaman yang luar biasa untuk rapat dan makan siang. Makanannya enak dan stafnya ramah dan membantu. Sangat direkomendasikan. Lainnya
ChZDSUhNMG9nS0VMYWNwTGlBbXB2LWVBEAE,5,"Hotel yang bagus, pelayanan prima, hotel yang direkomendasikan untuk perjalanan liburan/bisnis."
ChdDSUhNMG9nS0VJQ0FnSUQ3NDRyanVnRRAB,5,"Suasana dan lingkungan secara keseluruhan bagus.
Pelayanannya bagus. Makanannya juga enak.
Ada juga hidangan tradisional. Lainnya"
ChZDSUhNMG9nS0VJQ0FnSUNoc3RDSlBnEAE,5,"Nasinya setengah matang. Kebersihannya bagus. Air minum tidak diperlukan, dan dispenser tidak perlu disediakan di lorong hotel. Lainnya"
ChZDSUhNMG9nS0VJQ0FnSURKLVllWEhBEAE,5,"Semuanya baik-baik saja, mulai dari resepsionisnya. Kamarnya sangat bersih, rapi, dan nyaman. Restorannya nyaman dan makanannya sangat lezat. Akan merekomendasikannya kepada orang lain. Lainnya"
ChdDSUhNMG9nS0VJQ0FnSUNuOEliUzhBRRAB,5,"Kamarnya sangat bersih, lokasinya sangat strategis di pusat kota Jogja. Direkomendasikan untuk keluarga yang berlibur ke Jogja. Lainnya"
ChZDSUhNMG9nS0VJQ0FnSURXMloySkd3EAE,5,"Nyaman banget!
Pemandangan di restorannya bagus!
Menu sarapannya kebanyakan tradisional tapi enak dan kaya rasa. Wajib masuk daftar tempat menginapmu. Lainnya"
ChZDSUhNMG9nS0VJQ0FnSUNEOF9qUUJREAE,5,Tempat yang luar biasa dengan keramahan staf yang luar biasa. Menunya beragam dan rasanya lezat. Sempurna untuk acara keluarga/kantor Anda! Lainnya
ChZDSUhNMG9nS0VJQ0FnSUNJdnFTTE9BEAE,5,"Stafnya luar biasa, tidak ada keluhan. Kamar bersih dan luas, layanan laundry-nya bagus. Jadi, secara keseluruhan tidak ada keluhan, tetapi staflah yang membuat perbedaan. Mereka berusaha keras untuk membantu dan membuat Anda merasa seperti di rumah sendiri."
ChZDSUhNMG9nS0VJQ0FnSURmM3RmVlRnEAE,5,Hotel tempat saya bisa menghabiskan hari terakhir tahun 2024 dengan kemewahan dan kebahagiaan. Keramahan dan keramahannya sangat baik. Lainnya
ChZDSUhNMG9nS0VJQ0FnSURKaFBfWVZREAE,5,"Pemandangan dari restoran sangat indah, menambah selera makan, menu banyak pilihan, overall Mercure bagus, worth it untuk dikunjungi lagi Lainnya"
ChdDSUhNMG9nS0VJQ0FnSUNBc0lYNnRRRRAB,5,"kamar saya menghadap ke kolam renang dan anak saya sangat menyukainya. saya suka sarapan di resto, pemandangannya bagus dengan menu yang lengkap tapi lobi terlalu kecil untuk hotel bintang 5. saya suka suasana hotel ini. hotel yang sangat direkomendasikan di Jogja menurut saya."
ChdDSUhNMG9nS0VJQ0FnSUQtbm95Vl9RRRAB,5,"Pelayanan di restoran ungu sangat memuaskan, pelayannya sangat ramah dan cepat tanggap dalam menanggapi permintaan saya, tak lupa salah satu pelayan menjelaskan dengan ramah mengenai kuliner lokal yang dipajang di prasmanan."
ChZDSUhNMG9nS0VJQ0FnSUNSenJxQVFREAE,5,Saya senang menginap di sini. Sarapannya sangat enak dan tempat tidurnya sangat nyaman! Saya sangat merekomendasikan menginap di sini dan saya tidak keberatan menginap di sini lagi. Bantal panjangnya yang terbaik 🤩 … Lainnya
ChZDSUhNMG9nS0VJQ0FnTUN3b3BxM0VREAE,5,"Makanan lengkap, dessert lengkap, tempat bukber yang direkomendasikan"
ChdDSUhNMG9nS0VJQ0FnSUMyb3Y2MG9BRRAB,5,"Pengalaman pertama menginap di hotel grand mercure jogja, tempatnya di tengah kota. Dekat dengan pusat perbelanjaan, fasilitasnya lengkap, dan saya mencoba perawatan spa, saya mengikuti perawatan selama 90 menit, terapisnya ramah, dan pelayanannya sangat memuaskan. Semoga besok bisa menginap lagi di hotel ini. Terima kasih 👍 …"
ChZDSUhNMG9nS0VJQ0FnSUNYLTVpMUhBEAE,5,"Pemandangannya indah, pelayanannya baik, dan makanannya lezat. Pasti akan kembali lagi. Salut!Jenis … Lainnya"
ChdDSUhNMG9nS0VJQ0FnSURMdnNTcXpRRRAB,5,"Bagus dan mantap, pelayanan prima dari staf terutama nona taffy, rasa sarapannya enak dan semua makanannya Lainnya"
ChZDSUhNMG9nS0VJQ0FnSUR3N0x6MWZBEAE,5,"Saya belum pernah memesan kamar di sini, tapi saya sudah beberapa kali mengadakan pertemuan di sini dan saya sangat menikmati suasananya, ruang dansanya, prasmanannya, dan juga makanannya. Favorit saya adalah saladnya!"
ChZDSUhNMG9nS0VJQ0FnSUR6cC1IWUVREAE,5,"Terima kasih, pengalaman menyenangkan di Mercure, pilihan menu banyak dan sesuai selera...Jenis perj… Lainnya"
