review_id,rating,review
ChdDSUhNMG9nS0VJQ0FnSURwdllMbHdnRRAB,5,"Staff ramah dan helpful, kamar luas, sarapan enak dan banyak variasi menu tapi tidak disediakan tempat cuci tangan atau minimal tisu basah, karena megang botol kecap, sambal, dan aneka saus kadang lengket dan ga bisa hanya di lap pakai lap kering.

Nilai plus tambahan adalah di seberang hotel banyak penjual makanan, dekat mesjid jadi bisa denger adzan dengan jelas, dekat apotek, minimarket dan laundry kiloan.Jenis perjalananBisnisGrup perjalananKeluargaKamar: 5Layanan: 5Lokasi: 5KamarKamarnya kurang kedap, saya bisa dengar kamar sebelah ngobrol, apabila mereka geser kursi kedengeran sekali.Detail pentingSebetulnya bukan kamar tapi yang disayangkan adalah semprotan toilet eco washer yang airnya keluar dari belakang jadi agak kurang healthy, semoga kedepan ditambahkan selang spray jadi ada 2 opsi mau pakai eco washer atau pakai spraySorotan hotelMewah, Pemandangan yang indah, Tenang, Cocok untuk anak-anak"
ChZDSUhNMG9nS0VJUGszdmJaM1lEYUxnEAE,5,Hotel rekomended untuk liburan bersama keluargaTempat strategis dengan pelayanan dan fasilitas yang memuaskan.
ChZDSUhNMG9nS0VJQ0FnSUNaMzdxS1dBEAE,5,Pengalaman saya dan suami pertama kali menginap di Tentrem Htl Jogya minggu lalu selama 3 Night/ 4 Days sangat berkesan. Semua Staff sangat ramah menyapa. Lobby yg bagus dan luas juga Room yg luas dan nyaman.. Dapat Compliment snack di kamar dan letak Htl yg juga Strategis dari jalan. Aroma rempah terutama sereh tercium harum. Dan saya suka sekali dengan aroma Shower Gel juga Body Lotionnya yg harum. Saya senang ada dijual di Galeri Sido Muncul jadi saya  bisa membelinya utk di rumah. Pokoke The Best buat Tentrem Htl Jogya 👍👍 Next time pengen kembali menginap disini lagi 🙏🤗Jenis perjalananLiburanGrup perjalananPasanganKamar: 5Layanan: 5Lokasi: 5Sorotan hotelMewah
ChZDSUhNMG9nS0VJQ0FnSUR2bzZXbVlREAE,5,"Hotel terbaik di jogja, suasana nyaman , interior bagus, pelayanan bagus, bersih dan tenang. Very recomended👍🏻👍🏻Jenis perjalananLiburanGrup perjalananKeluargaKamar: 5Layanan: 5Lokasi: 5KamarBesar, nyaman dan bersihAktivitas di sekitarTempat Gym nya besar dan komplitKeamananBanyak CCTVArea untuk berjalan kakiNyaman untuk pejalan kakiMakanan & minumanMakanan dan minuman semua enak dan ada bbrp resto disiniDetail pentingOver all 👍🏻👍🏻Sorotan hotelMewah, Pemandangan yang indah, Romantis, Tenang, Cocok untuk anak-anak, Berteknologi tinggi"
ChdDSUhNMG9nS0VJQ0FnSURqc0xyRV9BRRAB,3,"Baru pertama kali coba Tentrem krn sebelumnya saya Termasuk Team Marriott krn platinum member marriott bonvoy, Bagi para hottelier di jogja itu ada 2 team luxury hotel yaitu team marriott dan team tentrem
Niat hati mau coba berlabuh jd Team Tentrem krn anak udah nuntut kalo staycation wajib ada Kids Playground, jadilah nyobain Tentrem Hotel
Ehh ga tau nya langsung dapet bad experience, saya sampai jam 1 siang langsung CI(saya tau jam ci tentrem jam 3,niatnya memang mau ke PG anak dulu) tp pas ci di info sm FO kamar ready 30menit lg, tapi nyatanya sampai jam 3 belum ready dan anak2 sudah bad mood 😔
Room : stay di premium king with balcony, Standard 5star lah amenities, minibar komplit cuma Smart Tv nya ampas banget lemotnya ga kira2 ga responsif remote nya
Fasilitas : Pool, gym, sauna kids Playground worth lah untuk luxury hotel, staff jg ramah tp sama emak bapaknya doang, team sebelah bahkan ramah banget staffnya sm anak2
Lokasi : Termasuk oke lah, ga terlalu jauh sm tugu kalo mau ke angkringan 🤣

Conclusion : Saya tetap team MarriottJenis perjalananLiburanGrup perjalananKeluargaKamar: 3Layanan: 1Lokasi: 4Sorotan hotelMewah"
ChZDSUhNMG9nS0VJQ0FnSUREa3VHNFB3EAE,5,"Belum pernah nginap disini. Hanya Buka Bersama saja dengan teman2x kerja. Alhamdulillah masakan enak, hanya banyak tradisional foodnya karena temanya Nusantara. Paling enak es cream tolak anginnya gak ada duanya.Grup perjalananTemanKamar: 5Layanan: 5Lokasi: 5Sorotan hotelPemandangan yang indah, Cocok untuk anak-anak"
ChZDSUhNMG9nS0VJQ0FnTUNJanRPSkR3EAE,5,"Bukber disini sangat recomended, makanan lengkap, servis ok, rasa terjamin enak, walaupun cukup pricey tapi juga worth it.Kamar: 5Layanan: 5Lokasi: 5"
ChZDSUhNMG9nS0VJQ0FnSURwMlllSUVBEAE,5,"Salah satu hotel berbintang 5 di kota yogyakarta, dengan lokasi yg sangat strategis di pusat kota.
Kesan lux sudah terasa saat memasuki lobby nya, suasananya nyaman dengan harum wewangian lemongrass.
Kamarnya termasuk besar dengan 2 ranjang single queen size dengan pemandangan pool view
Sarapan pagi nya sangat² lengakap termasuk juga beberapa makanan legendaris khas jogjakarta dihadirkan disini. Terima kasih buat miss Sandra yg memberikan informasi bbrp t4 wisata hiden gem di yogya
Sungguh pengalaman yg sangat menarik untuk menginap disini kembaliJenis perjalananLiburanKamar: 5Layanan: 5Lokasi: 4"
ChdDSUhNMG9nS0VJQ0FnSUQtOTVpMmlBRRAB,2,"Kesimpulan. Fine untuk hotel bintang 3. Ga worth it banget buat hotel bintang 5. Ga kepikiran kok bisa bintang 5. Saya sering ke bintang 3 yang jauh lebih bagus dari ini. Menang pamor doank dan lokasi yang tengah kota, paling mungkin worth it untuk orang yang bawa banyak business man ke hotel yang tinggal lama buat fasilitas fasilitasnya. Dateng2 ga boleh early check in, ok fine, ga masalah. Dateng ga dibantu siapa2 bawa barangnya, hotel ga ada bathtub. Saya sering ke hotel 1.5jt kebawah banyak bathtub, ini 1.9jt...bukan holiday. Itu 1.5jt kebawah holiday. Mahalnya. Ke toilet, ada bercak2 debu ato kotoran ga ngerti deh di toiletnya,, ga dibersihin ato gmn, hand dryernya bangunin 1 rt tapi ga panas jadi ngeringin tangan butuh waktu 5 menit.

Dikasih eskrim 1 scoop kecil ato minuman 1 perkamar padahal kamar kita twin buat 2 orang.

Nunggu 1.5jam kita mau ngemil di hotel dulu, mesennya ribetnya, ""ini kak kita ga ada menu fisik jadi harus qr"", trus dibawain 1 menu doank buat 4 orang. Mau mesen, manggil, ga ada yang dateng. Semenit ada teriak2 manggil dateng orang, ""owh itu bukan bagian saya bu"", ditinggal, dipanggilin yang bagiannya nunggu 1 menit lagi.

Begitu dah jam 3 kamarnya baru jadi 1. 1 lagi masih nunggu. Bintang 5? Hellloo?? Masuk kamar bener ga ada bathtub. Keran wastafel ga terlalu ke tengah jadi air gampang nyiprat keluar wastafel. Yang lebih parah keran shower. Kerannya hanya bisa diputar ke kiri dan kanan, yang bawah kiri buat air panas, kanan buat air dingin, yang atas kiri buat shower atas yang kanan buat shower handle. Kalo ketengah buat berenti....airnya susah berenti. Tengah shower handlenya masih ngucur air. Begitu kekiri lagi shower atas malah nyala bikin basah seluruh tubuh. Kenapa ga dibikin tarik buat keluarin air aja sih? Sok artistik mau bikin sesuatu yang unik malah lupa sama fungsi utamanya.

Mau tidur kamar ternyata ga kedap suara, orang buka pintu jalan2 ngobrol di lorong kedengeran, orang di kamar sebelah ngobrol, jalan, geser furniture kedengeran juga.

Mending kalian kalo kesini yang pengen trendy trendy aja deh atau kalo mau bawa business client yang banyak dan tinggal lama gitu, karena ok ada fasilitas yang banyak untuk memfasilitasi kegitan seperti itu. Yang mau nyaman keluarga ato jumlahnya kecil, banyak hotel yang lebih murah yang lebih baik fasilitasnya. Apakah hotel ini membawa pengalaman buruk? Tidak terlalu. Apakah pantas bintang 5? Tidak sama sekali. Saya ke hotel bintang 4 selalu lebih baik dari ini dan itu saya kagum dan menantikan bagaimana hotel bintang 5. Ternyata mengecewakan.Jenis perjalananLiburanGrup perjalananKeluargaKamar: 3Layanan: 3Lokasi: 5"
ChZDSUhNMG9nS0VJQ0FnSUM1cEkyT1NnEAE,5,"Pengalaman yg menyenangkan sewaktu menginap disini.
Dari mulai pelayanan sampai fasilitasnya sangat baik.
Yg terpenting adalah, menu breakfastnya👍🏻👍🏻👍🏻👍🏻
Bener2 juaraaaaaaaa!
Di dekat kolam renang juga ada playground yg lumayan luas, bikin anak2 betah.Jenis perjalananLiburanGrup perjalananKeluargaKamar: 5Layanan: 5Lokasi: 5Sorotan hotelMewah, Cocok untuk anak-anak"
ChZDSUhNMG9nS0VJQ0FnSURidHZYZEVREAE,5,"Pengalama yang luar biasa menginap disini, dari mulai datang sampai pulang pelayanan berkelas, fasilitas sangat lengkap memanjakan orangtua sampai anak-anak, pertahankan dan tingkatkan!Jenis perjalananLiburanGrup perjalananKeluargaKamar: 5Layanan: 5Lokasi: 5Sorotan hotelMewah"
ChZDSUhNMG9nS0VJQ0FnTUNBdzZySGFnEAE,5,"4 hari' 3  Malam...... Hotel Bintang 5... yg mewah, bersih dan Breakfast yg enak banget selama Aku pilih hotel di Jogja....👍👍👍🙏🇮🇩🇮🇩🇮🇩Jenis perjalananLiburanGrup perjalananPasanganKamar: 5Layanan: 5Lokasi: 5KamarBersih, Luas.....dan tiap Snack coklat, buah2 an dan makanan kue tradisional Free setiap hari.Aktivitas di sekitarDekat Dengan KulineranKeamananBaikArea untuk berjalan kakiBaikMakanan & minumanTerbaikDetail pentingTempat parkir mobil yg luasSorotan hotelMewah, Tenang"
ChdDSUhNMG9nS0VJQ0FnSURKXzVtZ2hnRRAB,5,"Hotelnya hotel lama, tapi interiornya bagus. Selain kolam renang, terdapat playground untuk anak juga. Utk di playground harus pakai kaos kaki. Sarapan enak. Letak tidak jauh dari marioboro. Kamar juga bagus dan ada area outdornya. Harga juga tidak terlalu mahal. Letaknya juga segaris dengan jalan malioboro.Jenis perjalananLiburanGrup perjalananKeluargaKamar: 5Layanan: 5Lokasi: 5Sorotan hotelMewah"
ChdDSUhNMG9nS0VJQ0FnSUNtbXVpejd3RRAB,5,"Sebuah hotel berkelas yang ada di Yogyakarta dengan desain interior yang sangat mewah dan pelayanan yang ramah dan profesional dari para staffnya. Selain itu, lokasi Hotel Tentrem bisa dikatakan cukup strategis karena cukup dekat dengan area wisata Malioboro dan Stasiun Tugu juga.

Pada saat check in akan disediakan welcome drink yg bisa memilih diantara 2 minuman tradisional. Kamarnya yang sangat luas dengan bed yang lebar serta nyaman membuat pengunjung hotel nyaman disini terlebih lagi dilengkapi dengan set hotel yg lengkap.

Diluar dari itu, fasilitas lain yang ditawarkan hotel tentrem antara lain kolam renang, fitness center, spa, jacuzi, kid playground area, ruang kaca untuk latihan dance. Menurut saya pribadi playgroundnya yang luas dan cukup lengkap akan sangat disukai anak-anak, dan fitness centernya juga memiliki alat-alat yang cukup lengkap dan modern. Ballroom disini juga cukup luas, dan ruang meetingnya juga cukup tertata, namun sedikit masukan untuk kabel VGA sepertinya perlu diperbarui agar tidak mudah terdisconnect.

Breakfast hotel disediakan untuk 2 orang namun tentative, bisa juga request lebih dengan penambahan extra bed. Biaya per malam di sekitar Nov 2021 ini berkisar 1.2-1.5jt per malam. Harga ini cukup worth it menurut saya dengan semua benefit dan fasilitas yang didapatkan."
ChZDSUhNMG9nS0VJQ0FnSURHNDVxU0hnEAE,5,"Salah satu hotel bintang lima yang ada di Jogja. Punya parkiran yang luas. Kolam renang yang bersih. Dan ballroom yang sangat megah. Setiap masuk hotel atau ballroom, selalu ada bau aromaterapi yang jadi ciri khas dari hotel tentrem. Pelayanan di sini juga menyenangkan dan memuaskan. Makanannya juga enak-enak"
ChdDSUhNMG9nS0VJQ0FnSUQtMjR6MnJBRRAB,5,"Hotel bintang 5 dengan lokasi strategis di dekat tugu jogja, dekat lobby ada toko makanan kecil, coklat, kue² kering , enakJenis perjalananLiburanGrup perjalananKeluargaKamar: 5Layanan: 5Lokasi: 5Sorotan hotelMewah, Romantis"
ChZDSUhNMG9nS0VJQ0FnSUNCd3BEQUVREAE,5,"Servisnya ok. Dapat welcome drink dg pilihan minuman2 tradisional atau gelato. Kamar twin bed kasurnya size queen yg nyaman yg masih muat utk 2 orang per bed sehingga cocok untuk keluarga 4 org supaya bisa sekamar. Dapat 4 air mineral 600ml setiap harinya. Ada fasilitas safe, setrika dan hair dryer di tiap kamarJenis perjalananBisnisGrup perjalananPasanganKamar: 5Layanan: 5Lokasi: 5KamarKamar twin bed kasurnya size queen sehingga masih muat utk 2 orang per bed dan cocok untuk keluarga 4 org supaya bisa sekamar. Mandinya masih shower, tidak ada bathtubSorotan hotelMewah"
Ci9DQUlRQUNvZENodHljRjlvT2t4eGVFb3lZemRzVlRoQ1kydFRPUzF2TkV0eGIzYxAB,5,"Hotel yang sangat nyamanJenis perjalananBisnisGrup perjalananTemanKamar: 5Layanan: 5Lokasi: 5Sorotan hotelMewah, Pemandangan yang indah, Romantis, Tenang, Cocok untuk anak-anak, Harga terbaik"
ChdDSUhNMG9nS0VJQ0FnSUROb3FhX3NRRRAB,5,"Sangat puas berada di hotel ini, aroma terapinya membuat nyaman berada di kamarnya,
Semua pelayanan kamar lokasi bagus
Fasilitas bagus, namun di tv jika dari YouTube langsung pindah ke channel TV itu tidak bisa, begitu pula sebaliknya,Kamar: 5Layanan: 5Lokasi: 5"
ChdDSUhNMG9nS0VJQ0FnSURoX1k2SDVnRRAB,5,"Lokasi startegis dekat tugu Jogja dan stasiun kereta api. Di sekitar hotel banyak makanan dan jajanan enak.

Staff ramah dan sangat membantu. Welcome drink ada 2 pilihan: minuman atau gelato.

Kamar luas dilengkapi dengan sofa yang besar, cukup untuk tidur orang dewasa.
Kloset dan shower terpisah di dalam kamar mandi, dilengkapi dengan toiletries yang lengkap.

Ada fasilitas brankas, setrika set lengkap, hair dryer, bathrobe, TV cable dengan akses YouTube, cemilan, minuman botol di dalam cooler yang boleh diminum gratis, dan yang menarik mini bar nya disediakan kopi tanamera sachet.

Sarapan banyak pilihan menu dan jajanan tradisional, seperti thiwul, klepon, jamu. Dan rasanya hampir semua enak, mengobati rasa kangen masakan di rumah bagi yang merantau. Untuk menu yang ada setiap hari: bakso, mie ayam, gudeg. Jika di kamar disediakan kopi tanamera sachet, disini bisa bebas seduh kopi tanamera dengan berbagai pilihan kopi yang lebih lengkap. Oya satu lagi, eskrimnya wajib dicoba.

Saya menginap selama 5 hari 4 malam, dan tidak ada yang mengecewakan. Akan merekomendasikan kepada teman dan kerabat!"
ChZDSUhNMG9nS0VJQ0FnSUQyaVl2d2JnEAE,5,"Staying at this hotel was an excellent experience. Kamarnya luas, spacy, dan nyaman. Cocok untuk staycation dan liburan keluarga. Interiornya unik dengan konsep jawa tapi modern. Service yang ditawarkan juga sangat baik dan bagus. Terdapat banyak fasilitas yang menunjang pengalaman pengunjung saat menginap di hotel ini. Mulai dari kolam renang, jacuzzi, gym, dan indoor playground. Saat breakfast, menu yang ditawarkan juga sangat beragam, seperti makanan khas Yogyakarta, berbagai makanan indonesia, sushi, hingga western-style breakfast. Di dekat lobby juga terdapat bar dan cake shop Eboni yang menawarkan diskon happy hour saat malam. Kuenya enak, tempatnya cukup nyaman. Selain itu, lokasi hotel juga strategis, dekat dari mana-mana. Overall, menginap di Hotel Tentrem Yogyakarta sangat memuaskan👍Jenis perjalananLiburanGrup perjalananKeluargaKamar: 5Layanan: 5Lokasi: 5"
ChdDSUhNMG9nS0VJQ0FnSURaNUltV2t3RRAB,5,"Masyaa Allah.. Ga akan pernah nyesel siih kesini..
Keren bangeeet. Trimakasih Kamarnya diupgrade karena lg ulang tahun nikah. Ada teras luar, bisa lihat pemandangan kota.
Kolam renang luas dan indah, yg paling keren tempat sauna dan jacuzzi.
Breakfast top smua, apalagi jamu beras kencur nya enak banget.Kamar: 5Layanan: 5Lokasi: 5"
ChZDSUhNMG9nS0VJQ0FnSUQ5N05UUk1BEAE,5,"Sukakkk!! Visit tentrem is like knowing more about Yogyakarta, cukup jarang hotel membubuhkan kekentalan budaya disandingkan dengan kemajuan jaman, mulai dr branding sampai arsitekturnya best!

Point plusnya lainnya banyak spt di kulkas ada tolak angin, kukubima dll. Breakfastnya good, es krim tolak angin juga enak bgt. Lalu untuk welcome drinknya kita bisa pilih bbrp minuman jamu dan ada gift shop cantik sprti museum kecil.Kamar: 5Layanan: 5Lokasi: 5"
ChdDSUhNMG9nS0VJQ0FnSUNadExySHZRRRAB,5,"its the best hotel in Yogyakarta i guess?!?! semua nya ok banget dari kamar, services, receptionist, ramah dan baik2 banget. setiap hari selalu di kasih treats yang di antar ke kamar?!? (dapat macaron, chocolate), sebelum check-in time, juga di kasih welcome treats (bisa jamu, eskrim, etc) yang bisa diclaim sembari nunggu kamarnya ready deh! bener2 di treat like a princess!Jenis perjalananLiburanGrup perjalananKeluargaKamar: 5Layanan: 5Lokasi: 5Sorotan hotelHarga terbaik"
ChZDSUhNMG9nS0VJQ0FnSURfM3JpS1JBEAE,5,"Pengalaman menginap yang seru & menyenangkan. Saya dibantu mas fander untuk pelayanan kamarnya 👍🏻Jenis perjalananBisnisKamar: 5Layanan: 5Lokasi: 5Sorotan hotelMewah, Pemandangan yang indah"
Ci9DQUlRQUNvZENodHljRjlvT2pKdlZ6ZGxWVjlpUW5CeWNGaFNRblk0Y0Vwa2IxRRAB,5,Cocok pokoknya bintang 5 selalu di jaga ya kualitas nyaKamar: 5Layanan: 5Lokasi: 5
ChdDSUhNMG9nS0VJQ0FnSUNaeXRiajJBRRAB,5,"Berkunjung dan mencoba menginap dalam 2 hari.
Banyak terkesan untuk bangunan vintage dan classy dalam hotelnya, untuk permalam sangat terjangkau

Worth it, pelayanan staff kamarnya ramah, breakfast juga sangat menikmati hidanganya.

Untuk mampir hotel terdekat dengan pasar klewer untuk cari oleh-oleh.Jenis perjalananBisnisKamar: 5Layanan: 5Lokasi: 5Sorotan hotelMewah, Pemandangan yang indah, Romantis, Tenang, Cocok untuk anak-anak, Harga terbaik, Berteknologi tinggi"
ChZDSUhNMG9nS0VJQ0FnSURWaF92VERREAE,5,"Lunch di Yum Cha Brunch (karena kita reservasi untuk jam 1, jadi ku sebut lunch) harga per pax 139k (sebelum pajak). Enak beud semua fried dimsumnya, dessert nya juga enak yg coconut pudding, gak manis bget. Oolong tea the best buat netralin semua makanan. Jika makanan yg di pesan gak habis bisa kena charge ya. Jadi makanlah sesuai porsi. Alhamdulilah kita makannya habis karena emang selapar itu dan porsi nya juga gak banyak n gak sedikit. Next mau kesini cobain chicken hainan yg katanya temanku enak jugaJenis perjalananLiburanGrup perjalananTemanKamar: 4Layanan: 5Lokasi: 5Makanan & minumanTry Yum Cha brunch for the first time..."
ChZDSUhNMG9nS0VJQ0FnSUNxcTR1RVdnEAE,5,"Sesuai dengan harga, hotel ini tidak mengecewakan. Saya menginap di premiere room, kamar ini hanya ada di lantai 2 saja, kelebihannya kamar ini memiliki balkon dengan total luas kamar 50sqm. Namun belum bathub, tidak masalah untuk saya, sudah menggunakan smart tv. Kamar saya 224 sempat bermasalah dengan tuas shower namun diperbaiki teknisi dengan cepat cukup 5 menit saja, staff juga ramah semua. Untuk breakfast makanannya lebih mendominasi makanan nusantara karena hotel ini lebih mengutamakan hal-hal lokal. Proses check-in check-out cepat. Hanya 2 hal yang menurut saya kurang, parkiran mobil dengan lobby jaraknya cukup jauh, harus melewati jembatan penyeberamgan antar 2 gedung, saya yg membawa lansia cukup merepotkan, kemudian kamar sisi selatan tidak memiliki lift, dari parkiran di selatan saya harus ke lift disebelah lobby dahulu kemudian menyeberang lagi ke selatan, seharusnya dapat dibuat lift di 2 sisi utara dan selatan. Namun secara kesuluruhan hotel ini sempurna. Saya rekomen dan saya akan datang kembali lagi."
ChdDSUhNMG9nS0VJQ0FnSURQbXZmUjh3RRAB,5,"Hotel tentrem yogyakarta termasuk hotel terbaik di jogja kamar banyak luas bersih dan nyaman, layanan oke pelayan sopan tradisi budaya jogja, lokasi strategisJenis perjalananBisnisGrup perjalananKeluargaKamar: 5Layanan: 5Lokasi: 5Sorotan hotelMewah, Pemandangan yang indah, Romantis, Tenang, Cocok untuk anak-anak, Harga terbaik, Berteknologi tinggi"
ChZDSUhNMG9nS0VJQ0FnSURUMVl6blh3EAE,5,"Menginap disini lagi..26 Mei 2024..

Acara show After party Kejurnas Sprint Rally di Ballroomnya..

Testimoni kamar :

Nyenyak tidur disini..
- Kamar yg lega+ ada Sofa,  bantal yg empuk,  AC HONEYWELL
- Smart TV
- Kamar mandi lega dan bersih..
- Hairdryer ✅
- Ironing ✅Jenis perjalananBisnisGrup perjalananTemanKamar: 5Layanan: 5Lokasi: 5Sorotan hotelMewah, Tenang"
ChZDSUhNMG9nS0VJQ0FnSURwMWZickNnEAE,5,"Saya merekomendasikan hotel ini yang menawarkan pemandangan aesthetics dan kemewahannya.

Disain : sanget mewah dan dinding dibalut dengan batu alam peletakannya pun benar benar mewah Perawatannya pun benar bener di jaga . Dan loby hotelnya pun luas.

Untuk koridor kamar sangat bagus sekali dengan ambience yang comfy banget, dan juga di pasang karpet yang seperti loby hotel yang terasa sangat mewah dan elegan, dan kamar sanget bersih.
Dan di sini pembersihan selalu di jaga dan di cek oleh sinar UV membuat sangetlah  bersih."
ChdDSUhNMG9nS0VJQ0FnSUQtbjRPa2pnRRAB,3,"Check in di tanggal 12 dec, sangat lama, dari jam 15.45 dan baru bisa masuk kamar di 18.30. Staff depan juga tidak dapat memberikan kamar hingga 3 hari kedepan di kamar yg sama sehingga harus pindah esokan harinya, namun dengan staff yang berbeda hal tersebut dengan mudah bisa dilakukan dikarenakan masih tersedianya kamar dengan type yang sama untuk 3 hari kedepan. Sungguh seolah sebuah diskriminasi. Hotel bintang 5 rasa bintang 2 soal pelayanan. Untuk kamar cukup baik dan luas. Parkiran bisa dibilang nyaman berada di bawah sehingga terbebas dari hujan dan panas. Lokasi dekat dengan tugu jogja. Sarapan pagi sangat bervariatif dan cocok di lidah. Untuk layanan not recomended, namun untuk stay kamar cukup nyaman.Jenis perjalananLiburanGrup perjalananKeluargaKamar: 4Layanan: 2Lokasi: 4"
ChdDSUhNMG9nS0VJQ0FnSURCOEtIODVnRRAB,5,"Wooow...
What a great experience staying in this hotel... !
Keren banget, setiap hari tepat di jam 10 pagi, selalu di putar lagu kebangsaan Indonesia Raya dan semua tamu dan staff hotel di himbau untuk berdiri selama lagu tersebut dikumandangkan.
Berasa beda aja, setelah selama ini muter² di hotel² di Indonesia, baru kali ini ada hotel yang memutar lagu kebangsaan tersebut.
Pertahankan yaa...
Service nya juga excellent, staffnya ramah banget dan fasilitas²nya oke punya.
Untuk yang membawa anak, no worries, disini ada kolam renang yang cozy banget dan kids playground yang seru...
Soo... Kalo ada kesempatan ke Yogya lagi, In syaa Allah, hotel ini adalah salah satu hotel yang menjadi pilihan utama untum staycation..
Mantaaab... !!!Jenis perjalananBisnisGrup perjalananPasanganKamar: 5Layanan: 5Lokasi: 5Sorotan hotelMewah, Pemandangan yang indah, Romantis, Cocok untuk anak-anak"
ChdDSUhNMG9nS0VJQ0FnSUNOOXRqa3JnRRAB,2,"Utk keseluruhan hotel bagus, namun sebagai ibu yg masih mengasihi, sayang sekali tidak ada kulkas chiller yg bisa mendinginkan di kamar. Chiller di kamar hanya utk menyejukkan minuman, tidak bisa mendinginkan. Jadi harus telp bolak balik untuk nyimpan dan ambil ASI. Sangat merepotkan dan memakan waktu lama shg anak saya keburu rewel. Mana setiap diminta ASI nya, semua kebingungan krn petugas yg jaga bergantian. Sangat mengecewakan 👎🏻👎🏻 Mohon utk dijadikan masukan dan pertimbangan. Krn tulisan ini pun mungkin bisa jadi pertimbangan bagi ibu2 di luar sana yg masih mengasihi, juga saya, utk next nya.Jenis perjalananBisnisGrup perjalananKeluargaKamar: 2Layanan: 2Lokasi: 2"
ChdDSUhNMG9nS0VJQ0FnSUN4NjdqdjlRRRAB,2,"Benar-benar trip paling mengecewakan yang saya pernah rasakan. Sofa bed kotor dengan bad bug membuat kulit gatal merah seketika. Ketika complain, room service datang dengan vacum penyedot karpet LANTAI, itupun lebih dari 30mnt setelah complain. Total saya menghabiskan 2 jam lebih hanya untuk mendapatkan penanganan membuat saya sendiri terlambat hadir ke acara dan mengalami experience yang sungguh mengecewakan
It was horrified! Staff was very slow. Such a shame for a five-star hotel to have service like this!Jenis perjalananLiburanGrup perjalananKeluargaKamar: 1Layanan: 2Lokasi: 3"
ChZDSUhNMG9nS0VJQ0FnSUNwME55VkNnEAE,5,"Saya merekomendasikan hotel ini,  karena arsiteksturnya yang menarik,  lalu suasananya yg calm & quiet,  cocok untuk healing,  dibandingkan dengan Tentrem Semarang,  walaupun yg Smg lbh baru....suasana di situ sangat ramai aplgi weekend jdi tdk cocok utk healing,  di sana pool hotel bergabung dgn aptmen,  jadi ya maklumi aja.

Lalu servicenya di Tentrem Jogja ini memang juara,  orang2nya humble,  dan sigap,  terasa ramah ga dibuat2,  dengan senang hati menolong guest nya,  jadi ya seneng banget jadi guest nya 😍.

Lalu khas Tentrem Hotel yang memperkenalkan makanan khas setempat yang terbaik dari yang terbaik saat breakfast ini salah satu value yang mengena buat saya,  guest tidak perlu keluar utk cari local food terbaik lagi karena sudah tersedia di breakfasr area,  dan bs all u can eat pula,  ini jg bikin seneng banget.  Saya kurang suka biasanya hotel berusaha memasak sendiri local food dengan chefnya,  padahal tamu2 maunya itu merasakan taste asli local food yang top2 itu... gamau makanan street food yg dibuat di hotel 5 star .... ya kan,  nahh ini dia ngrti banget hahaa... pinter banget 👏🏻👏🏻

Thank you Tentrem JogjaKamar: 4Layanan: 5Lokasi: 4"
ChdDSUhNMG9nS0VJQ0FnSUMtbmZUYjNnRRAB,5,"Menginap dari tanggal 6-10 november 22, utk keperluan acara konsinyering hotelnya sangat luas dgn fasilitas yg lengkap mulai dr gym, kolam renang, sauna dan lapangan tenis, kamarnya sangat luas dan besar overall pelayanan sangat baik petugas dgn tanggap membantu dan melayani tamu hotel, breakfast variasi menunya sangat banyak. Hanya utk makan siang menurut saya variasi menunya sangat sedikit dan mengenai rasa tidak terlalu istimewa. Mungkin dapat ditingkat kan lagiKamar: 5Layanan: 4Lokasi: 4"
ChZDSUhNMG9nS0VJQ0FnSURPbk5iNkF3EAE,5,"hotel terbaik utk berlibur bersama keluarga di Yogyakarta. Bahkan jika kita membawa 2 anak kecil,hotel ini menyediakan ranjang twin berukuran besar yg sangat memadai utk 2 dewasa+2 anak kecil. Ukuran ranjang besar,kamar luas,toilet & shower terpisah (2 cubicle),amenities lengkap,fasilitas hotel lengkap (kids club besar,breakfast enak dan bervariasi,kolam renang bersih dan terawat),servicesnya memuaskan (staff memperhatikan setiap detail yg sy tuliskan saat memesan kamar melalui OTA),dan yg terpenting sangat2 terasa bersihnya.
Worth with the price (disarankan pesan jauh2 hari seb libur utk dapat harga terbaik).
thank you Hotel Tentrem Yogya..definisi hotel keluarga terbaik akhirnya kami temukan di hotel ini❤❤Jenis perjalananLiburanGrup perjalananKeluargaKamar: 5Layanan: 5Lokasi: 5"
