review_id,rating,review
ChZDSUhNMG9nS0VJQ0FnSURZbEszSklnEAE,2,"FYI, the wall of the room is too thin. I can hear most of the annoying sounds from either above or next to my room. Yang kayak gini bikin rating turun menurutku, no offense but that's my honest review about this hotel. Kalau yg lainnya menurutku udah okelah, dengan harga segitu kalo sampe fasilitas ancur ya kebangetan. Mungkin perlu dipertebal lagi dindingnya, bener2 bikin ga bisa tidur karna suara berisik kamar sebelah dan suara orang lari2 di lantai atas."
ChdDSUhNMG9nS0VJQ0FnSURuX3NMUDRnRRAB,5,bagus huat acara cuma sayang mushalanya terlalu kecil untuk kegiatan dengan banyak pesertaKamar: 5Layanan: 5Lokasi: 5
ChdDSUhNMG9nS0VJQ0FnSUNJMXQyNnJBRRAB,5,"Suatu pengalaman yang menyenangkan bisa merasakan makanan saat breakfast di kayu manis coffee shop, dan dimsum brunch di summer palace. Semua makanan nya enak, dan menjadi hal menarik disana. Tempat nya sangat asik untuk berfoto, toiletnya nyaman dan bersih. Kolam renang nya cukup luas."
ChdDSUhNMG9nS0VJQ0FnSURJcEliWW5BRRAB,5,"Lobbynya luas sampe ada bajaj parkir (?) Masuk2 ke lobby langsung disuguhi aroma jamu2 khas sido muncul. Liftnya juga luas jadi gak perlu desek2an kalo bawa banyak barang. Servisnya juga oke. Tapi restorannya kerasa penuh dan padet, kayanya gara2 atapnya gak tinggi dan layout mejanya mepet2. Makanan enak, yg paling favorit itu roti kukus pake eskrim. Fyi ada eskrim buat orang pinter alias rasa tolak angin"
ChdDSUhNMG9nS0VJQ0FnSUN6bnVyZXRBRRAB,4,"Internet di Ballroom tidak stabil dan bisa jadi sangat lambat, tidak bisa diandalkan padahal jadi salah satu kebutuhan penting saat Meeting.Jenis perjalananBisnisGrup perjalananPasanganLayanan: 5Lokasi: 5Sorotan hotelMewah, Pemandangan yang indah, Romantis, Tenang"
ChZDSUhNMG9nS0VJQ0FnSUNHbVBHREZBEAE,5,"Hotel yang luas, indah, dan nyaman. Staff nya ramah dan helpful. Banyak spot cantik untuk foto. Ruangan bersih. Makanan dan minuman enak, lezat; harga ya harga hotel bintang 5. Recommended utk keluarga."
ChZDSUhNMG9nS0VJQ0FnSUREOGVTZElREAE,5,"Bener2 dbuat tentrem menginap disini. Pelayanan mmuaskan , menu2nya ccok dlidah, fasilitas lgkap . Topp😍Kamar: 5Layanan: 5Lokasi: 5"
ChZDSUhNMG9nS0VJQ0FnSUNabVlXeVVBEAE,5,"Sudah jelas, hotel terbaik di Jogja. Worth the price. Staffs ramah semua. Breakfast variatif, komplit, enak semua. Simply the best.Jenis perjalananBisnisGrup perjalananKeluargaKamar: 5Layanan: 5Lokasi: 5Sorotan hotelMewah, Romantis, Cocok untuk anak-anak, Harga terbaik"
ChZDSUhNMG9nS0VJQ0FnSUNxbzZtYUpBEAE,5,"Luar biasaa...., sangat pantas menyandang bintang 5.

Kamar lapang, swimming pool luas, breakfast super lengkap dari western hingga lokal. Parkir basement relatif selalu available

Semua staf sangat ramah dan helpful. Bravo mas YuliantoJenis perjalananLiburanGrup perjalananKeluarga"
ChdDSUhNMG9nS0VJQ0FnSURYenJ1bHdRRRAB,5,"Ballroom nya luar biasa,nyaman meski banyak pengunjung AC ttp efektif. Keren🤩🤩Grup perjalananTemanLayanan: 4Lokasi: 5Sorotan hotelTenang"
ChdDSUhNMG9nS0VJQ0FnSUR1dk1qNDJ3RRAB,5,"Pelayananya bgs,kita puas hotel sangat nyaman, dan tidak lupa dengan kebersihan kamar yang di bersihkan oleh mbak frisca dan mas tabarico.pembersihan kamar rapi dan ramah,,,tidak lupa dengan masakan restonya sangat enak dan kondisi bersihJenis perjalananBisnisKamar: 5Layanan: 5Lokasi: 5"
ChZDSUhNMG9nS0VJQ0FnSUNveE5DVkdREAE,4,"Lobbynya besar dan luas. Welcome drink nya jamu.

Kamar lumayan luas, ada sofa tidurnya. Cermin make up ada di toilet dan lemari di pojok belakang pintu. Lemari besar tapi kurang menampung banyak. Ada sandal plus baju mandi. Setrikaan disiapin.

Sabun, shampoo, conditioner, handbody, toothbrush, toothpaste, sisir, cutton bud, shower cap, lengkap. Showernya terpisah sama toiletnya jadi ga becek. Ada hairdryer.

Mineral water, tea, sugar, ada berbagai minuman, tersedia juga tolak angin. Ada buah juga free.

Handle showernya keren, beda sama yang lain, tapi sayangnya klo tangan licin, susah bwt muternya.

Ga ada kapas lempengan yang biasa bwt bersihin muka."
ChZDSUhNMG9nS0VJQ0FnSURRdUotQmZnEAE,5,"Superluv banget sama hotel ini
Sebagai penganut paham staycation yang doyan makan, disini banyak banget stall nya.
Pelayanan super ramah
Fasilitas superbanyak
Cuma kelemahannya satu, kalau pesan melalui pihak ketiga, kita harus konfirmasi ke pihak hotel sendiri jauh jauh hari apa yg kita inginkan biar fasilitasnya bisa kita optimalkan."
ChZDSUhNMG9nS0VJQ0FnSURld0xfV0d3EAE,5,"kamarnya luas, bersih dan rapi. interior terlihat mewah, hidangan sarapan yang disajikan juga beragam dan enak-enak. staff hotel pun ramah-ramah.Kamar: 5Layanan: 5Lokasi: 5"
Ci9DQUlRQUNvZENodHljRjlvT2sxSlpVZGZTRGw0VTA1cWVqRkJha0pEWkVOR1RWRRAB,5,Hotel mewah dengan khas JogjaKamar: 5Layanan: 5Lokasi: 4
ChZDSUhNMG9nS0VJQ0FnSUNZb3ZHQkNnEAE,4,"Hotel bintang lima terbaik menurut saya di jogja, akses sangat mudah dijangkau dari tugu jogja, resepsionis sampai satpam sangat rama dan sangat membantu, masakan yang ditawarkan sangat enak. Sebanding dengan harga yang diberikan. Kolam renang memiliki pemandangan yang bagus"
ChZDSUhNMG9nS0VJQ0FnSUNiLUt6VkRnEAE,5,"Ini hotel bagus banget, sumpah. Nyaman dan sangat rekomended untuk semua orang."
ChZDSUhNMG9nS0VJQ0FnSUNKd3NyNWJREAE,5,"Semua terasa sempurna, mulai dr complimentary, checkin tepat waktu, staff yg cekatan dan ramah, breakfast, fitness center hingga ke personel security yg profesional.Kamar: 5Layanan: 5Lokasi: 5"
ChZDSUhNMG9nS0VJQ0FnSURRdHNyak93EAE,4,Air panas kurang oke. Padahal bukan jam sibuk mandi. Untuk hotel selevel bintang lima msh harus di improve. Pada saat check in kita di kasih kamar pojok. Pd saat minta ganti sempet diskusi lama. Tapi akhirnya di ksh kamar lain.
ChZDSUhNMG9nS0VJQ0FnSUNRNXNmdVB3EAE,5,"Salah satu hotel favorit yaa di jogja. Suka banget dengan tentrem, 2x stay di sini selalu bagus. Hotel ini ciri khasnya aromanya herba-herba, kayak sereh gitu. Wangi segar di setiap sudutnya, enggak apek. Sangat unik. Pelayanan di hotel ini sangat ramah dan memuaskan. Arsitekturnya pun bagus, perpaduan modern otentik gitu. Recommended buat yang ingin sensasi hotel terbagus dan berbeda di jogja."
ChdDSUhNMG9nS0VJQ0FnSUNCNC1ySHhBRRAB,4,"Lokasinya strategis, bangunannya juga sangat menarik.
Kamarnya sangat nyaman , bersih , staff juga friendly.
Salah satu highlights hotel ini adalah breakfastnya , deliciousJenis perjalananLiburanGrup perjalananTemanKamar: 4Layanan: 4Lokasi: 4KamarComfyMakanan & minumanTastySorotan hotelPemandangan yang indah, Cocok untuk anak-anak"
ChdDSUhNMG9nS0VJQ0FnSURJbjRyN2lnRRAB,5,"Interior hotel bagus memanjakann mata even toiletnya cantik untuk selfie wkwk
Aroma semacam rempah (mngkin) yang enak dan bikin rilex memenuhi hotel. Asli sih aromanya itu enak bgt gatau nmanya apa tpi ngangenin hahaha
Kamarnya bagus dan nyaman, pegawainya ramah dan profesional. Ruang tunggu dekat resepsionist nyaman bgt.
Diluar depan hotel ada alfamart deket counter pulsa. Mau nyebrang aja dibantuin pak satpam nicee.
Keseluruhan ni hotel bagus bgt dan rekomen 👍"
ChZDSUhNMG9nS0VJQ0FnSUNLeWRYWlJ3EAE,5,"Tempatnya nyaman, proses check in dan dan check out cepat, kamar setiap hari dibersihkan, buah dan minuman jika habis selalu diisi, pelayanan ramah, helpfull, bersih, protokol kesehatan sangat baik. Sangat recommended
👍👍 …"
ChZDSUhNMG9nS0VJQ0FnSUNBdnZTWUNREAE,5,"Sangat nyaman utk menginap di sini. Kamarnya cukup luas, tenang, menu makanannya cukup bervariasi & rasanya juga enak. Recommended deh utk yg mau berlibur di Jogja. Di sekitar hotel pun banyak penjual makanan."
ChdDSUhNMG9nS0VJQ0FnSURtZ0szb3JnRRAB,3,"Memang hotel bintang 5 , tetapi menurut saya banyak kurangnya saya harusnya dapet kamar di jam 3 tetapi baru dapat di jam 6 , harga dengan kamar tidak sesuai biasa saja , terima kasih , semoga bisa lebih baik"
ChZDSUhNMG9nS0VJQ0FnTURRdloyak5nEAE,5,"Makan cukup enak, selera Indonesia, pelayanan bagus, tempat juga bersiKamar: 5Layanan: 5Lokasi: 5"
ChdDSUhNMG9nS0VJQ0FnSUQtbS02WDd3RRAB,5,"Hotel yg sangat amat rekomended, bf lengkap, kolam bersih, staff ramah, playground menyenangkan bs dibawa pulang hasilnya. Thank you.Jenis perjalananLiburanGrup perjalananKeluargaKamar: 5Layanan: 5Lokasi: 5Sorotan hotelMewah, Pemandangan yang indah, Romantis, Cocok untuk anak-anak, Harga terbaik"
ChZDSUhNMG9nS0VJQ0FnSUNvbWViU1BREAE,4,"Hotel dgn bangunan yg cukup megah dan elegant. Design arsitekturalnya jg cukup indah dgn pernak pernik ornamen di dinding dan pilar yg sangat menawan.
Fasilitas Ballroom yg disediakan jg cukup banyak.
Dan utk harga yas sesuai dgn rate hotel ini..."
ChZDSUhNMG9nS0VJQ0FnSUQ2bUl2ekpBEAE,5,"wow pokoknya, wow, wow, dan wow terus menerus pokoknya, kamar nyaman, luas, kolam renang bersih dan luas, jacuzzi dan sauna yang mantap, permainan anak yang banyak ada playground, billiard, fitnessnya juga sip banget nget nget. pokoknya pasti aakn saya ulangi lagi lagi dan lagi menginap di sini."
ChZDSUhNMG9nS0VJQ0FnSUNLMk5qSVdBEAE,5,"Nyamannsih, cmn penasaran aja itu basement dikasih karpet gt biar ga licin sebenernya bagus, tp kalau kondisi kering tidak hujan alas kaki vs karpet itu bikin jalan kurang nyaman dan di telinga agak berisik"
ChZDSUhNMG9nS0VJQ0FnSURnNElUY1p3EAE,5,"Hotel ini bagus arsitekturnya krn setiap lantai bnyk hiasan2 unik,kamar nyaman krn bed dan ukuran kmr bsr,kmr mandi bsr lgkp alat2 mandinya,pelayanannya ramah2 apa yg kt mnta lngsung cpt di respon, stiap kmr ada minibar dan kta mndapatkan minuman botol dan kleng scra gratis stiap harinya,dpt minuman sachet endorse dri tolak angin stiap hari, resto sarapan pagi super lngkp baik dlm negri maupun luar dan mkanannya buat sya hmpir smua enak, sya ska eskrim tolak anginnya, ktika kita chek in dpt minuman selamat datang kunyit asam dan alang sari. pling kita ska dsni bsa sauna gratis fasilitas hotel. Pokoknya hotel tentrem ini is the besst."
ChdDSUhNMG9nS0VJQ0FnSUNnZ3FxWml3RRAB,5,Makanan enak.. pool suhunya anget bs renang malam nyaman. Wlpun twin bed tp besar. Kmr luas.. bersih. Outdoor area pool ga ada nyamuk.. luar biasa. Bersih.
ChdDSUhNMG9nS0VJQ0FnSUN3dGJIc21BRRAB,4,"Saya haya sebentar datang kemana untuk melihat dan minum dengan beberapa teman..... service bagus, harga nggak murah untuk ukuran Yogya. Kursi2 sudah banyak yang terkelupas di lounge nya. Nice beer.... Hotel di Yogya tapi musik di lounge nya kok musik dugem siang pula...."
ChdDSUhNMG9nS0VJQ0FnSUNJdjR5NjlnRRAB,5,"Lokasi cukup strategis ditengah tengah kota Jogja , pelayanannya bagus , variasi makanan breakfast lengkap  mulai dari makanan tradisional lokal tahu kupat , cetil , tiwul , pecel , jamu jawa , kue , makanan internasional .
Desain interiornya bagus ... tapi kenapa ada kendaraan Bajaj dipajang di lobby hotel ? .... jadi penasaran"
ChdDSUhNMG9nS0VJQ0FnSURoaE9YczFnRRAB,5,"Salah satu hotel terbaik yang pernah saya singgahi... nuansa jawa modern amat sangat kental di sini.. romantic banget... 😊
Room bintang 5, dan yang paling mengesankan selain pelayanan adalah menu breaaakkfaaaassstt.... asli ini beda dengan hotel lain, biasanya rasa masakan hotel sudah terstandar.. tetapi di Tentrem Hotel akan menemukan rasa yang berbeda... misal bakso, rasanya bener bener bakso gerobakan tapi dengan rasa premium... 😊..dan masakan lain.. banyak bothnya, harus dicoba satu-satu... intinya jangan makan nasi dulu biar gak kekenyangan...  yakin dan sila di coba.. come to hotel tentrem... punya sido munculJenis perjalananLiburanGrup perjalananTunggalKamar: 5Layanan: 5Lokasi: 5KamarStandar room hotel bintang 5... five stars hotel premiumMakanan & minumanMenu Masakan lokal dan internasionalSorotan hotelMewah, Pemandangan yang indah, Romantis, Tenang, Cocok untuk anak-anak, Harga terbaik"
ChZDSUhNMG9nS0VJQ0FnSURPNG9yRmFnEAE,3,Sebenarnya enakkkk banget sih kamarnya n service nya yg luar biasa..pasti balik sini lg..cuma 1 yg bikin agak sebel n kecewa itu..kita nginap 5 hari 4 malam pas mau extend dksh hrga 8jt smlm..pdhl kita udh mlm dsni..masa dsamain sama yg baru booking hari itu..kita kan udh 4mlm gt..Jenis perjalananBisnisGrup perjalananKeluargaKamar: 5Layanan: 5Lokasi: 5
ChdDSUhNMG9nS0VJQ0FnSURPMWVUVjJBRRAB,5,"Hotel yg plg di Rekomen kalau nginap di Jogja , Bersih & Kamar Besar serta seluruh gedung wangi daun sereh , karyawan yg Ramah semua nya , serta Jangan lupa utk beli Batik di toko Batik di dlm hotel Tentram , corak nya Bagus2 serta harga nya bila di bandingkan dgn tmpt lain msh lbh murah .
Sy pernah tanya mbak yg jaga , katanya koleksi Batik sutra yg ada di toko semua nya adalah pilihan lsg dari owner nya .Jenis perjalananLiburan"
ChZDSUhNMG9nS0VJQ0FnSUNnazZIT1NREAE,3,"Waktu itu ikutan seminar sih di sini. Ballroom nya nyaman, pendingin ruangannya jga gk terllu dingin. Rasanya sejuk2 gitu. Toiletnya luas banget dan bersih banget. Tapi hati2 ya kalo jalan di toiletnya. Kadang suka hampir kepleset krn pas saya ksna kondisinya becek.
Tapi di antara itu smua yg pling penting adl makanannya.. Wuaahh. Nampooll. Uwenakk banget!! Recomended lah kalo mau bikin acara dsni..."
ChdDSUhNMG9nS0VJQ0FnSURXa3FTS3N3RRAB,5,"Pelayanan sangat baik dan ramah, kamar sangat bersih dan harum, fasilitas lengkap, ada complimentary buah dan minuman, makanan enak semua, ada smart TV yg bisa dipakai untuk akses YouTube juga, sangat recommended."
ChdDSUhNMG9nS0VJQ0FnSUNnOV9INzFnRRAB,5,"Hotel secara keseluran bagus dan enak, pelayanan sangat baik mulai dari cleaning service sampai receptionis guards dl.
Makanan secara keseluruhan enak cuma ham rasanya kurang hanya asin saja...
Yang paling berkesan tempat tidur,bantal betul2 nyaman...
Kebersihan juga sangat bersih...
Kartu untuk lift kadang2 kesulitan indikatornya kurang jelas...
Sekian terimakasih.."
ChdDSUhNMG9nS0VJQ0FnSUNUbmFTcDZ3RRAB,5,"Kamar oke, pelayanan mantap
Ga ada handuk petugas lgsung gercep dateng dan minta maaf, semua staff ramahJenis perjalananBisnisGrup perjalananTunggalKamar: 4Layanan: 5Lokasi: 5Sorotan hotelMewah, Pemandangan yang indah, Cocok untuk anak-anak, Harga terbaik"
ChdDSUhNMG9nS0VJQ0FnSUNaaW92S3d3RRAB,5,Hotel mewah dengan pelayanan yang terbaik. Kamar mandi mewah elegan. dapat minuman produk sidomuncul. paling suka kopi jahenya mantapKamar: 5Layanan: 5Lokasi: 5
ChZDSUhNMG9nS0VJQ0FnSUMxNXQzWGFBEAE,5,"Makasih mb Diani dan mas Andika udh bikin kamar bersih dan fresh lagi setiap hari.. makin betah z nih. Hehe..
Sehat² ya kalian, Aamiin..

Jogja, 291223 pagi..Grup perjalananPasanganKamar: 5Layanan: 5Lokasi: 5KamarNyamanMakanan & minumanEndolita..Sorotan hotelRomantis"
ChdDSUhNMG9nS0VJQ0FnSUNSNk9maDF3RRAB,5,"Sempet garap event pertemuan kecil disini bareng GSP multimedia, Tempat nyaman, rapi bersih dan para staff juga ramah , hanya saja jalan dari lift loading barang sampai keruangan agak horor si wkwkwk jauh banget rasanya padahal deket."
ChdDSUhNMG9nS0VJQ0FnSURJalpIVHJ3RRAB,5,"Updated 2022:
Pertama kali ke small meeting roomnya, yah oke juga, seperti biasa service oke, ke sini untuk job ke sekian kalinya, biasa wedding di ball roomnya yg gede, kali ini untuk meeting saja. so far so good.

___
a huge ball room in this hotel makes me feel so small, really. so huge!Jenis perjalananBisnisLayanan: 4Lokasi: 5"
ChZDSUhNMG9nS0VJQ0FnSUMwanNIMktBEAE,5,Tempat di tengah kota. Hotel nyaman dgn desain marmer di dinding yg berkesan mewah. Makanan enak dibanding dgn yg lain. Ruang pertemuan jg sgt nyaman. Rekomendasi unt acara2 besar. Hanya AC ruangan sgt terasa dingin sampai terasa menggigil.
ChdDSUhNMG9nS0VJQ0FnSURnd1lqN2p3RRAB,5,"Hotel mewah yang sedang naik daun atau hits. Kuaitas sama dengan harga, hotel mewah ini juga mengusung nilai nilai tradisional, ruangannya saja berbau jawa jawa. Untuk hotel tentrem saya kasih bintang lima. Sangat senang dengan pelayanannya ramah dan sopan."
ChdDSUhNMG9nS0VJQ0FnSUNVNjZqOGxnRRAB,5,"Bagus banget, furniturnya mewah, dan setiap pelayanannya memuaskan. Sarapan paginya beragam dan banyak menu-menu tradisional indonesia khususnya jawa. Dari kamar saya pagi-pagi baru bangun tidur bisa langsung lihat gunung merapi, sangat indah sekali.Grup perjalananKeluargaKamar: 5Layanan: 5Lokasi: 5"
ChdDSUhNMG9nS0VJQ0FnSUNkMFBhTW53RRAB,5,"Gedung dan kamar nya mewah, bersih serta nyaman

Makanan breakfast nya banyak pilihan dan enak

Memang sesuai kelas bintang 5Kamar: 5Layanan: 5Lokasi: 5"
ChdDSUhNMG9nS0VJQ0FnSURtaHJTQnN3RRAB,5,"tempatnya sangat luaaassss... sangat nyamaaaannn... sangat bersiiihhh... memuaskaaaannn... gak bosen lah tiap disuruh jemput tamu di hotel ini...
Karyawan hotel sangat ramah,,senyum salam sapa...Jenis perjalananBisnisGrup perjalananTemanKamar: 5Layanan: 5Lokasi: 5Sorotan hotelMewah"
ChZDSUhNMG9nS0VJQ0FnSURnNGUtMmNREAE,5,"Hotelnya besar, kamar besar dan nyaman. Gym dan kolam renangnya juga besar. Minibar free, dpt welcome fruit di kamar dan ucapan selamat datang di layar TV.
Petugas hotel ramah2

Sangat puas menginap di hotel tentrem"
ChZDSUhNMG9nS0VJQ0FnSUNtOXZ1SURBEAE,5,"kamarrr luasss
ada sofaaa panjang
kamar mandi luasss
ada bath tub
free drink di kulkas
free buah2an
free tolak angin herbal
breakfast free untuk anak di bawah 8 taon.
breakfast komplit dari indonesian, western, japanese. ada ice cream nya juga lho."
ChdDSUhNMG9nS0VJQ0FnSUNpd3BqUzhRRRAB,5,"Kamar oke bangeet, dpt kamar yg balkonnya di depan dan di samping🤩 super ramah, helpful, bersih, makanan enak, semua fasilitas bs dipake, ga bosenin, dan sesuai protokol kesehatan. 4 hari 3 malam di sana alhamdulillah menyenangkan... …"
ChZDSUhNMG9nS0VJQ0FnSUNHMU9hWFJnEAE,5,"Menyenangkan sekali bisa staycation di hotel tentrem, pegawainya mulai dari security hingga room service ramah banget. Parkiran di basement luas, lobbynya mewah,cocok banget punya nama tentrem. Semoga ada kesempatan menginap lagi di tentrem baik di jogja maupun semarang :)"
Ci9DQUlRQUNvZENodHljRjlvT2tSeGJVc3lNRnAxY21sSlpIUjNaVUpYVTFneGNtYxAB,5,Sesuai namanya tentrem...tenang👍👍 …
ChdDSUhNMG9nS0VJQ0FnSUMydU1fcHpBRRAB,5,"Hotelnya bagus, pelayanannya juga bagus tapi sayang saat menukarkan kupon welcome drink dicuekin dan nggak dilayanin karena gratis. Karena berbarengan ada yg beli minuman berbayar.Jenis perjalananLiburanGrup perjalananKeluargaKamar: 5Layanan: 4Lokasi: 5"
ChZDSUhNMG9nS0VJQ0FnSUNaa2IteExREAE,5,"Kamarnya luas,sangat nyaman,bersih. Bakal sering² sini deh
Cs ramah,hamble
Lokasi strategis dari pusat wisatanyaJenis perjalananLiburanGrup perjalananPasanganKamar: 5Layanan: 5Lokasi: 5Sorotan hotelMewah, Pemandangan yang indah, Romantis, Tenang, Cocok untuk anak-anak, Harga terbaik, Berteknologi tinggi"
ChZDSUhNMG9nS0VJQ0FnSURrMl9ydkJREAE,5,"Ketika cek in. Dapat kamar di lantai 2 , saya berfikir dilantai 2 tidak ada pemandangan yang asik diluar hotel. Namun ternyata saya salah , justru ku temukan pemandangan yang bagus. Yakni Gunung Merapi Merbabu dan Sumbing.. silahkan berkhayal gimana asiknya"
ChdDSUhNMG9nS0VJQ0FnSURSaGR1Sm9RRRAB,5,"Interior mewah, parkir gratis, makanan enak, pelayanan sangat ramah. Kurangnya mungkin tidak ada taman yang luas atau khas yang lain tapi lokasinya di tengah kota banget jadi gampang ke mana-mana.Jenis perjalananLiburanGrup perjalananKeluargaKamar: 5Layanan: 5Lokasi: 4KamarKamarnya mewah banget.Aktivitas di sekitarDekat dengan Stasiun Tugu Yogyakarta dan Malioboro.Makanan & minumanMakanannya enak.Detail pentingInteriornya mewah banget.Sorotan hotelMewah"
ChdDSUhNMG9nS0VJQ0FnSUMyMjhEbHdBRRAB,4,Hotel Tentrem Yogyakarta adalah hotel bintang lima yang nyaman untuk tinggal. Para staff ramah seperti para staff hotel-hotel di Bali. Fasilitas merah dan bersih. Housekeeping nya super duper bersih dalam mengurus kamar-kamar hotelnya.Jenis perjalananLiburanGrup perjalananKeluargaKamar: 4Layanan: 5Lokasi: 4
ChZDSUhNMG9nS0VJQ0FnSURJOVlPcVJnEAE,4,Saya datang kesini untuk mengikuti pameran pendidikan. Pameran berlangsung di meeting room UG. Antusiasme pelajar yang datang sangat tinggi dan pihak hotel sangat peka untuk menyediakan kursi bagi pengunjung. Sayangnya meeting room yang dipakai cukup sempit sehingga kurang nyaman bagi saya untuk menikmati pameran. Semoga pameran berikutnya bisa menggunakan tempat yang lebih luas.
ChdDSUhNMG9nS0VJQ0FnSUNaM0tlZXJ3RRAB,5,"Hotelnya bagus, nyaman, pelayanan ramah dan fasilitas memadai. Cocok untuk tempat bermalamKamar: 5Layanan: 5Lokasi: 5"
ChdDSUhNMG9nS0VJQ0FnSUN3c2RIMW5nRRAB,4,"Kolam renang sangat rekomendasi. Sauna nya bersih dan terawat. Kamarnya rapi. Alternatif tempat gym di hotel yg bisa jadi pilihan karena alatnya lengkap, setelah ngegym bisa langsung renang atau menikmati sauna. Ada lapangan tenis yg besar. Kalao mau meeting banyak ruangan yang tersedia sesuai kebutuhan."
ChdDSUhNMG9nS0VJQ0FnSUNpbW9hZ3lRRRAB,5,"Bangunan bagus, fasilitas kamar oke. Cma balkon tdk ada kursi santai. Harga diatas 1jt,  parkir ada 3, P1, B1 dan B2. Paling dekat dengan kamar dan lobby p1. B1 dan 2 agak jauh."
ChdDSUhNMG9nS0VJQ0FnSURRenB6eG93RRAB,5,"Hotelnya cakep, kamar yg luas, makanannya sgt variatif, kamar mandi ya jg bagus, air panas ada, kemarin kebetulan free snack dan soft drink yg ada di lemari pendingin di kamar, televisinya jg keren, mantaplah pokonya Tentrem Hotel, Yogyakarta."
ChZDSUhNMG9nS0VJQ0FnSURHNm9EQ1lnEAE,3,"Lebih megah dan lebih besar dr tentrem semarang.kamar2 nya mirip.khas tentrem.mdel tempat tidur nya jg mirip.cukup nyaman nginap di tentrem.SAYANG HOTEL MEGA INI MULAI TERASA KUSAM.KOLAM RENANG YG BESAR BS BUAT OLAHRAGA RENANG,AIRNYA KURANG TERAWAT.KARPET KAMAR HOTEL DAN LORONG HOTEL SSAAGGAATT KUSAM .CLOSET GOYANG,KERAMIK DINDING KAMAR MANDI TDK DIBERSIHKAN SAMPAI ATAS.MKIN KRN PANDEMI AT RAMAI,PERAWATAN KURANG MAKSIMAL..BANTAL2 PUN SDH TDK NYAMAN LAGI...SAYANG...BEDA KONDISINYA DG 2TH YANG LALU...kl tenntrem semarang masih segar .di jogja,kursi sofa panjang di ruang makan,sdh banyak bercak,spt di cafe2 pinggiran...jauh bda dg yg disemarang walaupun tarip lebih murah.kl nginap di tentrem jogja,suasana kamar lebih segar di lantai yg tinggi dpd yg bawah.mkin tamu2 kebanyakan pilih lantai bawah.dilantai2 atas lebih baik segalanya."
ChdDSUhNMG9nS0VJQ0FnSUNuaUlyS29BRRAB,5,"Lokasi strategis, tempat aesthetic dan wangi, kamar bagus, pelayanan ramah.Jenis perjalananLiburanGrup perjalananKeluargaKamar: 5Layanan: 5Lokasi: 5"
ChZDSUhNMG9nS0VJQ0FnSUNCcHZHN1NBEAE,5,"Bener2 hotel bintang 5 masuk lobby aja terasa aroma wewangian yang khas dan restonya amat luas,untuk menu breakfastnya sangat banyak pilihan...Jenis perjalananLiburanGrup perjalananTemanKamar: 5Layanan: 5Lokasi: 5Sorotan hotelMewah, Pemandangan yang indah, Romantis, Tenang, Cocok untuk anak-anak, Berteknologi tinggi"
ChZDSUhNMG9nS0VJQ0FnSUMxcEltZUFREAE,1,"Checkin lama sampe jam 5 sore
Jam 7 ac bocor sampe banjir
Besoknya jam 12 balik kamar, masih blm dibersihin listrik matiJenis perjalananLiburanGrup perjalananKeluargaKamar: 1Layanan: 1Lokasi: 1"
ChdDSUhNMG9nS0VJQ0FnSUMwaXRLc2pBRRAB,5,Assllammualaikumm. Tempatnya lumayan bagus juga. Soalnuya hotel tentrem itu termasuk hotel yang sudah lama gitu kan itupun hotel tentremnyapun banyak penampakan penampakan juga disana. Dan itu yang di ganti hanyalah barang barang kamar yang dari kamar hotel tersebut. Dan itu benar benar merinding banget. Yang bagian kolam renang itu bisa disebut seperti hutan hutan juga tentunya.
ChZDSUhNMG9nS0VJQ0FnSUNkMDUzVUJ3EAE,5,"sangat menyenangkan
pelayanan ramah
bersih
besar dan luas
makanan enak murah
dekat tempat wisata dan hiburanJenis perjalananBisnisGrup perjalananKeluargaKamar: 5Layanan: 5Lokasi: 5Kamarbersih totalAktivitas di sekitarkerenKeamananaman.:: menyenangkanArea untuk berjalan kakijalan aman dan penuh petunjukMakanan & minumanmakanan minuman enak…Sorotan hotelMewah, Pemandangan yang indah, Romantis, Tenang, Cocok untuk anak-anak, Harga terbaik, Berteknologi tinggi"
ChdDSUhNMG9nS0VJQ0FnSUNRM3QyZnN3RRAB,5,"Hotel baru dengan fasilitas yang sangat lengkap dan luas2 untuk setiap ruangnya, kamar yang luas, tempat gymnya bagus dan lengkap sekali, makanan dengan menu yang lezat dan komplit... ada es krim tolak angin (hotel pemilik dari perusahaan sido muncul)."
ChZDSUhNMG9nS0VJQ0FnSUQyOTdiRGR3EAE,5,"Cakep banget hotelnya. Super nyaman. Pelayanannya super super bagus, staffnya ramah dan helpful semua. MAKANANNYA ENAK ENAK BANGET PARAH. Kalo ga acara kantor kayanya ga mampu nginep disini, tapi kalo punya duit udah pasti milihnya tentrem.Jenis perjalananBisnisKamar: 5Layanan: 5Lokasi: 5"
ChZDSUhNMG9nS0VJQ0FnSUNROGRMVGZnEAE,5,"Hotel favorit di Yogyakarta. Begotu masuk hotel ini, langsung kecium wangi khasnya, aroma sereh yang kuat. Kamar, makanan, service OK banget. Tapi untuk kamar ada 1 kekurangan, yaitu kurang kedap suara. Kalau ke yogya lagi pasti mau balik nginep disini"
ChZDSUhNMG9nS0VJQ0FnSURRZ3RHaFNBEAE,5,Parkir gak terlalu luas tapu selalu dapet parkiran. Kamar besar. Ada playground anak. Kolam renang besar. Pelayan ramah. Makanan enak dan variatif. Free minibar. Gak jauh dr minimarket.
ChZDSUhNMG9nS0VJQ0FnSUNZd2ViLU5BEAE,5,"Hotel berkelas dengan cita rasa lokal. Aroma jahe  bisa ditemukan di mana-mana. Sabun, shampoo, conditioner, semua aroma jahe. Kalo sarapan, jangan lupa coba roti kukusnya. Mantul. Saya suka. Kerja cleaning servicenya juga cepat, ramah dan cekatan. Saya tinggal sarapan, pas balik lagi kamar uda bersih dan segala peralatan mandi dan teh kopi dkk sudah direfill lagi."
ChZDSUhNMG9nS0VJQ0FnSURNek1EMVpBEAE,5,Hotel bintang lima yang terletak di kota yogyakarta memberikan pelayanan yg sangat baik interior yang mewah membuat setiap orang yang menginap di hotel ini merasa nyaman. Makan yang disuguhkan pun sangat beragam dan lezat.
