review_id,rating,review
ChZDSUhNMG9nS0VJQ0FnSUNBMXZLWmNREAE,5,Hotelnya sangat bagus dan berkelas. Hotel untung orang2 kelas menengah atas. Pelayanannya sangat baik dan fasilitasnya sangat lengkap
ChdDSUhNMG9nS0VJQ0FnSURNN2FUcjhnRRAB,5,"Hotel modern yang tenang dan sangat nyaman untuk bersantai bersama keluarga.
Kamar maupun lobbynya luas banget."
ChZDSUhNMG9nS0VJQ0FnSUNaNGRtcUF3EAE,5,"Jauh jauh ke Yogyakarta ga nyesel nginep disini...tempatnya asik...tidurku nyaman banget... pelayanannya juga ok banget...

Next pasti akan nginep sini lagiiiKamar: 5Layanan: 5Lokasi: 5"
ChZDSUhNMG9nS0VJQ0FnSUNKdGZqeGFBEAE,4,"Untuk hotel sekelas Tentrem, valey mobil hrsny jadi fasilitas tamu, jgn berbayar 50 rb 😓😓😓Jenis perjalananLiburanGrup perjalananPasanganKamar: 4Layanan: 3Lokasi: 4Makanan & minumanWelcome drink, bs ditingkatkan dg ditambah snackSorotan hotelPemandangan yang indah, Tenang"
ChdDSUhNMG9nS0VJQ0FnSURCb2ZibzVBRRAB,4,Hotel nyaman untuk acara meeting grup namun harga sewa kamar per harinya diatas rata2Jenis perjalananBisnisGrup perjalananTunggalKamar: 4Layanan: 4Lokasi: 4Sorotan hotelTenang
ChZDSUhNMG9nS0VJQ0FnSURYcm9tOUJREAE,5,"Bagus,lengkap fasilitasnya, desain mewah,hadir kajian UHA"
ChdDSUhNMG9nS0VJQ0FnSURJMDVueXp3RRAB,5,Hotel uwaaw banget nih...nginep semalam disini kudu bawa uang bergepok2...tapi pelayanan dan fasilitas nya gak diragukan lagi..betah betaah
ChZDSUhNMG9nS0VJQ0FnSURJejdLM2RBEAE,5,"ini kali ke2 kesini dan selalu suka sama aroma disetiap ruangan, wewangian jawa banget mirip aroma minuman bandrex 😍.  de best hotel lah 😍😍 …"
ChdDSUhNMG9nS0VJQ0FnSUNRX0phQzl3RRAB,5,"Gak di ragukan lagi yg mau destinasi yg blm mencoba coba dijamin nyaman aman pasti tentram, ya hotel kelas papan atas ,
Ya yg punya nya bos sido muncul ,ya prodak jamu2 tolak angin ,premennya pada dimunculin, orang pintar ya nginep di hotel tentrem aja. .. .
Ka anda bajet memadai cabaan tuh pasca dipakai Obama mantan presiden amerika"
ChdDSUhNMG9nS0VJQ0FnSUNSMGZ6M3dRRRAB,5,"Hotel bintang 5 yg oke banget pelayanannya bagus, kamarnya nyaman sekali"
ChdDSUhNMG9nS0VJQ0FnSUM0aXNQYnd3RRAB,4,"Harga kamarnya memang mahal tapi fasilitas yg diberikan sesuai dengan harga yg dibayar, seperti Swimming poll, playground, duck king, indoor gym"
ChZDSUhNMG9nS0VJQ0FnSUNnMmFTUUZBEAE,5,"Salah satu hotel bintang 5 di jogja yang memberikan pelayanan terbaik dan fasilitas yang sangat lengkap dan memadai,sudah pasti memiliki makanan yang sangat nikmat"
ChdDSUhNMG9nS0VJQ0FnSUNKdHBmSDZ3RRAB,5,"Kran shower copot ,minta perbaikan sampai 1/2 hari. Mengecewakan untuk pelayanan hotel bintang 5Jenis perjalananLiburanGrup perjalananKeluargaKamar: 3Layanan: 3Lokasi: 3KamarKamar mandi bermasalah"
ChdDSUhNMG9nS0VJQ0FnSUNabksyRTNBRRAB,5,"Keren bett emang nih hotel
Ac dingin
Breakfast semuanya enak bgt
Puas pake bgt💖💖💖💖💖Jenis perjalananLiburanGrup perjalananKeluargaKamar: 5Layanan: 5Lokasi: 5KamarKamar besar dan bersih
Ok bgtMakanan & minumanSarapan nya banyak macam dan enak2 semua
Bubur ayam juara bgt👍👍👍Sorotan hotelTenang"
Ci9DQUlRQUNvZENodHljRjlvT25FMFdWUkJWVjk1Vm13MVNWWkJSVmRNY2xWeWRFRRAB,5,"Wangi parfum seraiJenis perjalananBisnisGrup perjalananTunggalKamar: 5Layanan: 5Lokasi: 5Sorotan hotelMewah, Tenang"
ChdDSUhNMG9nS0VJQ0FnTUNnaWVqTDN3RRAB,5,Hotel nyaman dan makanan paling enakKamar: 5Layanan: 5Lokasi: 5
ChZDSUhNMG9nS0VJQ0FnSUNBM0xPalRnEAE,5,"Tempat yang luar biasa, Barrack Obama dan orang² terkenal pernah tidur disini. Pengalaman berharga bisa mengikuti seminar di hotel ini."
ChdDSUhNMG9nS0VJQ0FnSURCdG9yS213RRAB,5,Hotelnya nyaman banget... menu sarapannya enak... ada gym dan play ground...Jenis perjalananLiburanGrup perjalananKeluarga
ChZDSUhNMG9nS0VJQ0FnSUN3b05YVUpnEAE,3,"sedikit mengecewakan untuk tamu yang menggunakan kendaraan roda 2, parkirannya berada di luar area hotel, padahal biasanya hotel bintang 1 pun menyediakan parkir roda 2 di basement"
ChZDSUhNMG9nS0VJQ0FnSUNldHNqNlFBEAE,5,"Hotelnya bagus banget, makanannya rnak, lobbynya wangi dedaunan segar. Top banget ini hotel."
ChZDSUhNMG9nS0VJQ0FnSURnZ3N2ZWFREAE,5,"Ini salah satu hotel megah di Jogja. Belum pernah nginap di sana. Bisa dibayangin aja, kalau menginap rasanya pasti hatinya Tentrem, dompetnya aja yg mungkin nggak Tentrem, ha-ha-ha"
ChZDSUhNMG9nS0VJQ0FnSUR1dl9MVE1BEAE,5,"mewah , oke, makanan nya tapi agak kurang menurut saya. ya standard hotel la yang biasanya agak kurang.

selain itu oke..Jenis perjalananLiburanGrup perjalananKeluargaKamar: 5Layanan: 5Lokasi: 5"
ChdDSUhNMG9nS0VJQ0FnSUNJM09qTHZnRRAB,3,"Tempat meeting luas, nyaman, kolam renang sangat bagus, ada playgroud untuk bermain anak, makanan cukup enak"
ChZDSUhNMG9nS0VJQ0FnSUN3X2ZlOVp3EAE,5,"Kereeen banget hotel nya.. Di utara Tugu jogja..

Dr luar udah keliatan keren, pas masuk ke daleemm.. Lebih keren lagi.. Luassss.. Makanannya juga enak enakk.. Bisa kesini gara2 ikut acara Kaskus. Hahahahaha.."
Ci9DQUlRQUNvZENodHljRjlvT25WdGEyOUlhbU5GZGxCRWRrdFFPVXBEUVd0dVJIYxAB,5,Kamarnya cozy dan luasJenis perjalananLiburanGrup perjalananKeluargaKamar: 5Layanan: 5Lokasi: 5Sorotan hotelTenang
ChZDSUhNMG9nS0VJQ0FnSUQ3a0p1SFRBEAE,5,"Hotel yg sangat bagus , kualitas oke ,Kamar: 5Layanan: 5"
ChdDSUhNMG9nS0VJQ0FnSUN5cjgyMjBRRRAB,4,"Tempat bagus parkir luas, karena covid jdi ngga bsa ngulas bnyak hahahaha overall recommended buat skedar dinner dgan couple or untuk wedding"
ChdDSUhNMG9nS0VJQ0FnSUN3Z3AtSDBRRRAB,5,Best hotel di Yogya... pelayanannya luar biasa dan care sama tamu yg menginap. Harga di atas rata2
ChdDSUhNMG9nS0VJQ0FnSUNzMzhXSTdRRRAB,5,Hotel tentrem sangat bagus  lumayan mahal tapi nyaman bau lobby nya seperti jamu dan ada minuman jamu dan beras kencor saya suka minuman seperti itu
ChdDSUhNMG9nS0VJQ0FnSURwby15WG5nRRAB,5,"Tempatnya sangat bagus dan nyaman ....
Cocok buat liburan atau perjalanan bisnis
MantapJenis perjalananLiburanGrup perjalananKeluargaKamar: 5Layanan: 5Lokasi: 5Sorotan hotelHarga terbaik"
ChZDSUhNMG9nS0VJQ0FnSUNrMW96YmRREAE,5,"Penginapan yg nyaman dr group sidomuncul, masuk loby tercium aroma terapi jamu. Kamarnya besar, so fancy."
ChdDSUhNMG9nS0VJQ0FnSUNROXZtM3VnRRAB,4,"Pengalaman saya nginep disini oke banget, dari mulai pelayanan sampai kamarnya pun ssuai dengan budget yang kita keluarkan
Gak kecewa lah 😊 …"
ChZDSUhNMG9nS0VJQ0FnSUNLb0s3alF3EAE,5,Best hotel in town... Interior full marmer dan kayu jati.. No wonder org² terkenal seperti Barrack Obama pernah nginap dsini
ChZDSUhNMG9nS0VJQ0FnSURnbG9iNkVBEAE,5,"Service bagus...
Menjalankan aturan sesuai dgn yg ditetapkan👍
Contoh sandal kamar tdk boleh dikenakan untuk ke restoran. …"
ChdDSUhNMG9nS0VJQ0FnSURvb01Qai1BRRAB,5,"Hotel mewah dengan pelayanan yang sangat sangat luar biasa. Hotel sangat bersih,  makanan semuanya enak banget.  Mobil boleh masuk ya,  untuk motor gak bisa hehe."
ChdDSUhNMG9nS0VJQ0FnSURkdmItZnRBRRAB,4,"Dlu sring mkn mlm dsna mnu enak tmpt nyamn ,, buat ank"" juga nymn playnan mmuasknLayanan: 5Lokasi: 4"
ChZDSUhNMG9nS0VJQ0FnSUNtNkpiRUp3EAE,5,"semuanya perfecto, khususnya sarapan dan keramahan layanan, layanan hotel terbaik yg pernah saya singgahi."
ChZDSUhNMG9nS0VJQ0FnTUNvaEtIN1VBEAE,5,"Dateng ke restonya EBoni, masakan enak bgtKamar: 5Layanan: 5Lokasi: 5"
ChdDSUhNMG9nS0VJQ0FnSUNTMHBqVmxBRRAB,5,"Hotelnya bagus,bersih dan rapi..rekomended buat yg mau halan2 ke jogja dan nyari hotel berbintang"
ChdDSUhNMG9nS0VJQ0FnSURzNG96THJnRRAB,5,Staff hotel melayani dengan baik. Kamar luas dan bersih. Ruang rapat nyaman dan breakfast variatif dan enak
ChZDSUhNMG9nS0VJQ0FnSURwM18zV0dREAE,5,Hotel bintang lima yg sangat bagus bikin nyaman fasilitas lengkap harga terjangkauKamar: 5Layanan: 5Lokasi: 5
ChZDSUhNMG9nS0VJQ0FnSUNnOEpEQkZ3EAE,5,"Hotel berbintang yang nyaman sekali, sarapan paginya uenak, makan siang apalagi, view kota yogyakarta dan gunung merapi, ecsotix"
ChdDSUhNMG9nS0VJQ0FnSUNMN2ZiOGdBRRAB,5,"Hunian nyaman, ramah pelayanan, makanan lengkap, harga worth it dengan fasilitas yang adaJenis perjalananLiburanGrup perjalananKeluargaKamar: 5Layanan: 5Lokasi: 5KamarNyaman dan bersihSorotan hotelTenang"
ChdDSUhNMG9nS0VJQ0FnSURsdWZ6cGtnRRAB,5,"Menurut rumor yang beredar presiden Obama waktu main ke Jogja tidur disini. Mungkin karena dekat dengan kali code.Jenis perjalananLiburanGrup perjalananKeluargaKamar: 5Layanan: 5Lokasi: 5Aktivitas di sekitarDeket dengan tugu jogja dan kawasan malioboroMakanan & minumanUntuk sarapan tersedia menu khas Jogja seperti gudek yu djum dan song dji, ada juga soto kadipiro dan soto pak soleh. Yang katanya didatangkan langsung dari dapur aslinya.Sorotan hotelMewah, Cocok untuk anak-anak"
ChdDSUhNMG9nS0VJQ0FnSUNPbllTNDh3RRAB,5,"Semuanya bintang lima mulai dari kamar, pelayanan, makanan minuman, sauna, kolam renang. Javanese hospitality nya bikin betah..Kamar: 5Layanan: 5"
ChZDSUhNMG9nS0VJQ0FnSURPM2U2Vkh3EAE,5,Kamar luas nyaman. Fasilitas lengkap. Breakfast enak banyak pilihan menu. Sangat nyaman.Jenis perjalananLiburanGrup perjalananKeluargaKamar: 5Layanan: 5Lokasi: 5
ChZDSUhNMG9nS0VJQ0FnSUN4bXRQeU5nEAE,5,Salah satu hotel yang bagus di Jogjakarta dengan keramahan semua staffnya. Nice hotel to stay.
ChdDSUhNMG9nS0VJQ0FnSUR1cF9mMzRRRRAB,5,"Hotel yg bagus yg berada d lingkungan perkotaan
Nyaman
Parkir mudah n luasJenis perjalananLiburanGrup perjalananKeluargaKamar: 5Layanan: 5Lokasi: 5"
ChZDSUhNMG9nS0VJQ0FnSURwd0tDZ1RnEAE,5,"Pelayanan nya sangat memuaskan, salut banget di lift ada kursi buat orang tua.Jenis perjalananBisnisGrup perjalananKeluargaKamar: 5Layanan: 5Lokasi: 5KamarExcellentKeamananSafety room dan akses kerenArea untuk berjalan kakiKerenMakanan & minumanJamu nya mantepSorotan hotelMewah"
ChZDSUhNMG9nS0VJQ0FnSUNJOGVxUEpBEAE,5,Tempat yang sangat bagus dan nyaman . Harga per kamar pun diatas 1jtan dr mulai grade paling rendah .
ChZDSUhNMG9nS0VJQ0FnSUN1dnFHbFhREAE,5,Hotel modern yang tetap memiliki unsur budaya yang cukup. Fasilitas dan pelayanan sangat baik.
ChZDSUhNMG9nS0VJQ0FnSURMX1ByNlV3EAE,5,"5 Star Experiences. Known as Hotel tempatnya Pak Jokowi kalo nginep di Jogja 😁Jenis perjalananBisnisGrup perjalananTemanKamar: 5Layanan: 5Lokasi: 5Sorotan hotelMewah, Pemandangan yang indah, Tenang"
ChZDSUhNMG9nS0VJQ0FnSUNJbjlISExnEAE,5,"Bagus bgt hotelnya the best pkoknya..service, kamar, kolam renang,gym, sauna dll lengkap semua."
ChdDSUhNMG9nS0VJQ0FnSURVeE16QzFRRRAB,4,"Hotel dengan kualitas kenyamanan, keramahan dan fasilitas yang oke...ditambah variasi pilihan makanan yg pas dilidah...T O P..."
ChZDSUhNMG9nS0VJQ0FnSUNPbFpiV2VBEAE,5,"Luar biasa....pelayanan yg sangat maksimal
Tuk sarapan, banyak pilihan....dua jempol pokoknyaKamar: 5Layanan: 5Lokasi: 5"
ChdDSUhNMG9nS0VJQ0FnSUQ2OWVQMjdnRRAB,5,"Kamarnya luas, tempat gymnya bagus , jacuzzi pool nya juga bagus bangett.. sarapannya enakkk"
ChZDSUhNMG9nS0VJQ0FnSURwdl9mUU5BEAE,5,"Hotelnya bagus, pelayanan baik dan fasilitas sangat nyaman....Grup perjalananTeman"
ChdDSUhNMG9nS0VJQ0FnSURnOXYyOGlRRRAB,4,hotelnya nyaman tpu sayang kamarnya mandinya kurang bersih skrg gak kaya dulu... cleaning service perlu ditingkatkan...
ChdDSUhNMG9nS0VJQ0FnSURBajV6ZC1nRRAB,5,"kamar yang luas, staff yang ramah, fasilitas lengkap, playgroundnya besar bgt cocok banget buat yang bawa anak anak! seruuu dan fun"
ChdDSUhNMG9nS0VJQ0FnSURZM2ZmaHVBRRAB,5,"Amazing place...bagus utk liburan keluarga sekaligus meeting corp, fasilitas yg sangat baik dan lengkap, makanan sangat baik"
Ci9DQUlRQUNvZENodHljRjlvT2s5Tk1VTmpjbFpIZW1NeE9UZFZNV3R0TlVGRlpYYxAB,5,Security disini sangat super ramah. saya hanya kurir laundry saja sangat dilayani layaknya tamu hotel. semoga selalu tetap menjaga performa pelayanannya dan semakin sukses 🙏Layanan: 5
Ci9DQUlRQUNvZENodHljRjlvT2twQ1NXaDJORmh1VDA1SllucDVSV3RKVTJsNGVtYxAB,5,Kamarnya luas dan bersih. Servisnya sangat baik. Hoteliersnya ramah.Fasilitas gymnya lumayan lengkap. Kolam renang oke juga. Makanan juga enak.Kamar: 5Layanan: 5Lokasi: 5
Ci9DQUlRQUNvZENodHljRjlvT2psa1VqVTBjWHBmUlZoM05rVTBjRU5oWDFSSU4wRRAB,5,Hotel terbaik di jogjaKamar: 5Layanan: 5Lokasi: 5
Ci9DQUlRQUNvZENodHljRjlvT21WRlJVY3RSMDlMUnpKaGVrUjZhRmxvY1hFM2JYYxAB,5,"Hotel bintang lima mewah yang memadukan desain modern dengan sentuhan tradisional Jawa kental, menawarkan suasana privat, fasilitas lengkap (kolam renang, spa, Kids Club, restoran). Lokasinya strategis dekat Tugu dan Malioboro, namun tetap tenang, menjadikannya landmark prestisius dengan pelayanan istimewa, interior kaya seni Jawa (gamelan, lukisan, hiasan), serta identik dengan keluarga Sido Muncul pemiliknya, memberikan pengalaman ""Tentrem"" (damai) di jantung kota.Jenis perjalananBisnisGrup perjalananTemanKamar: 5Layanan: 5Lokasi: 5Sorotan hotelMewah, Pemandangan yang indah, Tenang"
Ci9DQUlRQUNvZENodHljRjlvT2tOU01tczJZMmR4VEZVMFduSk1jbXAyVG1adFMwRRAB,5,"Menginap 1 malam (Sabtu–Minggu) untuk urusan kerja.
Lokasi sangat strategis, mudah ke mana-mana. Kamar cukup luas, bersih, dan nyaman, sesuai standar hotel bintang lima.
Amenity lengkap dan tertata rapi. Sarapan sangat beragam, tersedia pilihan makanan tradisional Indonesia hingga menu internasional, dengan kualitas rasa yang cukup baik.
Sempat ada insiden barang tertinggal milik salah satu rombongan, namun pihak hotel sangat sigap menghubungi kami melalui WhatsApp. Barang dapat kami ambil kembali dengan mudah sebelum pulang ke Jakarta.
Pelayanan responsif dan profesional. Sangat direkomendasikan untuk keperluan kerja maupun liburan.Jenis perjalananBisnisGrup perjalananTemanKamar: 5Layanan: 5Lokasi: 5Sorotan hotelMewah, Pemandangan yang indah, Tenang, Cocok untuk anak-anak"
Ci9DQUlRQUNvZENodHljRjlvT2pZMlQxUmhhelJNY1d4SFoxTmZURUoyVjNkdVVWRRAB,5,"Lokasinya strategis, dekat dengan berbagai tempat wisata. Meskipun waktu check-in normal adalah pukul 3 sore, kami diminta menunggu selama 20 menit lagi. Sepertinya kamar tidak kedap suara, kami terus mendengar suara seperti melompat-lompat dari tetangga yang berhenti setelah saya menghubungi resepsionis. Meskipun demikian, dekorasi dan makanannya enak.Grup perjalananTemanKamar: 4Layanan: 4Lokasi: 5Sorotan hotelMewah"
Ci9DQUlRQUNvZENodHljRjlvT2twa1RFaFhSa3hPVTIxT2RHd3hkSEJmUjBSbmMzYxAB,5,Kemewahan..Kamar: 5Layanan: 5Lokasi: 4
Ci9DQUlRQUNvZENodHljRjlvT2pOYU4waHVSWGx3TVhOdWExcHVWamx4WDJneUxWRRAB,5,"Pengalaman menginap yang menyenangkan dan berkesan.
Mulai dari proses check in sampai dengan check out semua berjalan lancar tanpa kendala, disiapkan handuk dingin yang menenangkan lelah badan di perjalanan, minuman jamu yang enak dan menyegarkan sebagai welcome drink bahkan bisa dinikmati setiap hari.
Beruntung juga sempat menikmati fasilitas cocktail evening di lantai 8, disiapkan makanan kecil mulai dari kacang, kletikan, makanan ringan seperti mini dimsum, pizza, pasta, kue2 sampai dengan buah2 an segar. Juga disediakan berbagai minuman.
Pokoknya menyenangkan sekali pengalaman menginap di hotel ini.
Seluruh staff nya ramah dan helpful juga selalu menyapa dengan sopan.
Semoga semakin baik lagi, dan semoga bisa menginap lagi di kunjungan kami ke Jogja berikutnya.
Sehat2 semuamya...Jenis perjalananBisnisGrup perjalananPasanganKamar: 5Layanan: 5Lokasi: 5KamarKamarnya luas dengan penerangan cukup dan fasilitas komplit.Aktivitas di sekitarDi seberang hotel ada alfamart 24 jam. Dan lokasi nya cukup dekat dengan pusat kota.Makanan & minumanSemuanya enak dan variasinya banyakSorotan hotelMewah, Tenang, Cocok untuk anak-anak, Harga terbaik, Berteknologi tinggi"
ChdDSUhNMG9nS0VJQ0FnSUMyaHVtdDZnRRAB,5,direkomendasikanKamar: 5Layanan: 5Lokasi: 5
Ci9DQUlRQUNvZENodHljRjlvT2xKS1NIWklUR0pxY21wbE1HUmFaRmQyVlVOWFdXYxAB,5,"Lokasi strategis bgt Utara Tugu. Fasilitas lengkap (minus golf n mini zoo). Member favorit fitness/ gym n swimming pool cm 8jt/ th. Tinggal sewa PT n lanjut ke apa. Vallet utk tamu di charge 50rb. Menu Bfast komplit bgt, lbh komplit dr lunch/ dinner. Pelayanan bintang 4 krn ada 1 staf cewek d Resto yg krg ramah.. sorryJenis perjalananLiburanGrup perjalananTemanKamar: 5Layanan: 4Lokasi: 5KamarStandard bintang 5Aktivitas di sekitarKrn di pusat kota Yogya, lalu lintas sekitar hotel cukup crowdedKeamananStandard bintang 5Area untuk berjalan kakiBagusMakanan & minumanExcellentSorotan hotelMewah, Romantis, Tenang, Cocok untuk anak-anak"
ChZDSUhNMG9nS0VPV2Q2TDZqMnUzdGFnEAE,5,"Terapis sangat terampil, ramah, sopan, suasana nyaman tenang, bersih & selalu dengan wangi khasnya hotel tentrem wangi sereh.|Feel like home and always want 2 be back again and again."
ChZDSUhNMG9nS0VJQ0FnSUNJLThpOEJnEAE,5,Salah satu hotel terbaik di YogyakartaKamar: 5Layanan: 5Lokasi: 5
Ci9DQUlRQUNvZENodHljRjlvT2sxdGVESkRZak5OVkcxVWJGSm5WVWwzY1ZsTWJsRRAB,5,Mahal tapi nyaman
ChdDSUhNMG9nS0VMM0Z5di1ZN29DWHRnRRAB,5,"Hotel Tentrem adalah salah satu hotel terbaik yang pernah saya kunjungi. Pengalaman di kolam renangnya juga selalu menyenangkan. Kolamnya terawat dengan baik, bersih, dan petugas kolam renang selalu berjaga sehingga memberikan rasa aman dan … Baca ulasan lainnya di Tripadvisor"
Ci9DQUlRQUNvZENodHljRjlvT2pSRk0yaHJla05vWmpOTlRraEJTWFp2ZVhjNFJsRRAB,5,Homy..Kamar: 5Layanan: 5… Lainnya
ChdDSUhNMG9nS0VMclBqNzJjMG9pWHdRRRAB,5,"Pengalaman menginap yang luar biasa di hotel fantastis ini.|Fasilitasnya sangat bagus, dan area gym adalah fitur unggulan, dilengkapi sepenuhnya dengan semua yang Anda butuhkan untuk tetap bugar dan sehat. |Stafnya sangat ramah dan … Baca ulasan lainnya di Tripadvisor"
Ci9DQUlRQUNvZENodHljRjlvT2xjM1RXcE5OVXRhVW05c1MwRXRWbXBIWjBkd1RHYxAB,5,"Hotel yang indah dan menawan tepat di jantung Yogyakarta, dengan makanan luar biasa di semua aspek — hidangan klasik Indonesia, masakan tradisional, Barat, Jepang, Cina, dan makanan penutup yang benar-benar enak. Menginap di hotel milik … Lainnya"
ChZDSUhNMG9nS0VOTHczNWYzeWV5clVnEAE,5,"Stafnya sangat ramah dan membantu, benar-benar melampaui ekspektasi!||Kamar bersih dan nyaman dengan pemandangan yang sempurna. Terasa seperti rumah sendiri.||Terima kasih Mas Rama, Yudi, Ahmad"
Ci9DQUlRQUNvZENodHljRjlvT2tKQldUbFlTV0l6YlZCNWRXRTVYMFZTYkRKV09YYxAB,5,MantaapppKamar: 5Layanan: … Lainnya
ChZDSUhNMG9nS0VJQ0FnSUNwNFl5elBREAE,5,👍 …Kamar: 5Layanan: 5… Lainnya
Ci9DQUlRQUNvZENodHljRjlvT25SMmNtRklha3BrVTJSbVFXZHNNeTB0U1dSMmJtYxAB,5,Hotel terbaik di Yogyakarta. Sarapannya luar biasa :)
ChdDSUhNMG9nS0VJbkdyc0Q4ZzdUaGxBRRAB,5,"Jacuzzi, sauna, minuman, dan makanannya sangat bagus. Pak Edris sebagai petugas sauna telah melayani saya dengan sangat baik. Saya harap saya dapat mengunjungi Tentrem lagi bersama keluarga saya."
Ci9DQUlRQUNvZENodHljRjlvT205UVNVNTFjRzFNTTJwUlRXZFNRM1Z1ZWtGTFIxRRAB,5,Hanya lewatJenis perjalananLiburan… Lainnya
Ci9DQUlRQUNvZENodHljRjlvT2tkVmRUWlFSVkZHVmxCdU1tTldlazFoUmxaNVJXYxAB,5,"Ramah anak, pilihan es krim unik yang dijual di toko rotinya.Jenis perjalanan… Lainnya"
ChdDSUhNMG9nS0VPdlQ0ZlhZbVlTMDBBRRAB,5,"Kunjungan pertama saya ke Gaharu Spa & Fitness Center di Tentrem Yogyakarta sungguh menyenangkan. Saya mencoba perawatan creambath mereka, dan itu sangat menenangkan, suasananya nyaman, tenang, dan membuat saya langsung merasa nyaman. … Baca ulasan lainnya di Tripadvisor"
ChdDSUhNMG9nS0VJQ3ZrTnlabDlPZjBRRRAB,5,"Kami menikmati masa inap yang menyenangkan dan tidur yang sangat nyaman di Hotel Tentrrm Yogyakarta. Mereka memberi kami kue potong gratis dan dekorasi cermin untuk ulang tahun pernikahan saya. Mereka bahkan melakukan hal ekstra dengan meningkatkan kamar kami, sungguh menyenangkan! Kami pasti akan menginap di sana lagi."
ChdDSUhNMG9nS0VNVHdpTU9mMU12TC1nRRAB,5,Pelayanan di MS.DEWIS sangat fantastis! Staf lainnya juga sangat ramah dan saya menikmati waktu yang menyenangkan. Saya senang karena ada beragam pilihan hidangan budaya untuk sarapan.
ChdDSUhNMG9nS0VNMmJnWXFNamNfUjlnRRAB,5,"Suasana dan atmosfer yang luar biasa... pengalaman yang hebat.... sangat menghargai pelayanan hangat dari Deni, Ahmad, dan Wisnu di kolam renang."
ChdDSUhNMG9nS0VJU2VzUG5qeUpISDRBRRAB,5,"Hotel yang indah. Sangat ramah sejak saat petugas pintu menyambut kami, hingga meja resepsionis yang berdedikasi, dan berbagai teh herbal di lobi. Staf, terutama mereka yang berada di pusat bisnis tempat kami sarapan dan makan malam, sangat … Baca ulasan lainnya di Tripadvisor"
ChdDSUhNMG9nS0VNLXc2NEh2Z09EOTdBRRAB,5,"Penginapan yang menyenangkan, makanan yang enak, pengalaman yang luar biasa, staf yang ramah dan membantu, terutama Mas Deni & Mas Junar. | Terima kasih Tentrem Hotel."
Ci9DQUlRQUNvZENodHljRjlvT25oWFNFdHhRWFpTVFhsT1lsSk9VWHB3VDFZd1JXYxAB,5,👍🏼 …Jenis perjalananBisnis… Lainnya
Ci9DQUlRQUNvZENodHljRjlvT2tkSldHazNlRmxPVGxGTlNYTk1TVTkzTjBWWGVYYxAB,5,"Mewah, tapi bukan kemewahan yang wajib dimiliki. Hal terbaik dari tempat ini adalah mereka sempurna. Mereka sangat memperhatikan pengalaman Anda. Seperti instruksi penggunaan shower. Seperti kopi, seperti camilan kecil di kamar Anda. Pengalaman yang menyenangkan. Lainnya"
Ci9DQUlRQUNvZENodHljRjlvT2pZMGJIUldkMUoxTWxaRVdXaExhVFJMVXpJNGJVRRAB,5,"Hotel yang bagus, tapi perlu menu sarapan yang lebih baikJenis perjalanan… Lainnya"
Ci9DQUlRQUNvZENodHljRjlvT25wMFpFYzVYMnQwU1d4VVNWUkpSR1p6UzFGRVJWRRAB,5,"Croissant yang lezat buatan Felicia Lie, Noell dan tim, terima kasih, renyah di gigitan pertama dan lembut di dalam, sangat lezat, saya memilih croissant polos dan kopi Toraja saya di akhir sarapan saya... Terima kasih Trentrem... Anda membuat hari saya menyenangkan Lainnya"
Ci9DQUlRQUNvZENodHljRjlvT25sQ1EydFlkMnBPYkdVd1NGRlBSVU5CVFdkVFZuYxAB,5,"Fasilitas gym-nya lengkap, membuat sesi olahraga saya nyaman selama menginap. Area jacuzzi dan sauna-nya luas dan menawarkan pengalaman yang menyenangkan dan menenangkan. Mereka juga menyediakan minuman sambutan, yaitu jamu. Secara keseluruhan, hotel ini memberikan sentuhan hangat dan berkesan saat saya tiba. Lainnya"
Ci9DQUlRQUNvZENodHljRjlvT2pOSFkxazFXRWRpVDBVd1RFUlBNRmRETVRRd2QwRRAB,5,Kuno tapi menawan. Makanannya enak. Kamarnya nyaman. Kolam renangnya fantastis.Jenis perjalanan… Lainnya
Ci9DQUlRQUNvZENodHljRjlvT25aTmJXdDNjekZ2TmpjellXNXJOSGRRTFRWRVltYxAB,5,Nganterin Undevided.Kamar: 5Layanan:… Lainnya
ChdDSUhNMG9nS0VNUHlxWnFENnZYTmpBRRAB,5,"Fantastis, luar biasa, unik, dan pijatan dengan Idris adalah bagian terbaik dari masa menginap saya di hotel ini. Saya akan mengulanginya seribu kali. Terima kasih."
Ci9DQUlRQUNvZENodHljRjlvT2s1T01FTmpNbVI0UVdoS1VUUTJORWgxTkRGUVgzYxAB,5,"Saya menginap di Hotel Tentrem Yogyakarta, dan sejujurnya, ini adalah salah satu pengalaman hotel terbaik yang pernah saya alami di Indonesia. Sejak pertama kali tiba, keramahannya luar biasa — stafnya hangat, sopan, dan penuh perhatian. … Lainnya"
Ci9DQUlRQUNvZENodHljRjlvT2xGelVERnhXbTFKUjFKemVFODFWMnQwVUZWV1RrRRAB,5,kamar yang nyamanJenis perjalananLiburan… Lainnya
Ci9DQUlRQUNvZENodHljRjlvT21KWGNHaFpZVVF0TWpOaGVWQnpNMmM1Y25WMmJYYxAB,5,"Menginap di hotel ini sangat menyenangkan. Yang paling berkesan dari kunjungan saya adalah sop buntut bakar dari Kayumanis Cafe.
Kami merayakan ulang tahun Ibu di restorannya yang bernama Summer Palace. … Lainnya"
Ci9DQUlRQUNvZENodHljRjlvT21KS2NtNXNVbVJ1Um1GcldYZFhaRk00UWpkTFJGRRAB,5,Hotelnya cantik banget dan wangi serai bikin kangen 😍❤️ …Sorotan hotelM… Lainnya
Ci9DQUlRQUNvZENodHljRjlvT2tweWFGVlFkVXMwUVY5TVRtaENlRFZtUzNRdFVHYxAB,5,Terima kasih untuk momen btfl.....Kamar: 5… Lainnya
Ci9DQUlRQUNvZENodHljRjlvT25GZlVWbDBValJHVjFCdFlVTXlTbkJQTm10Q00zYxAB,5,"Ini pertama kalinya saya menginap di sini, dan yang mengejutkan, dari awal hingga hari terakhir, semuanya begitu berkesan dan fantastis! Semua staf terlatih dengan baik, ramah, dan sangat membantu. Lainnya"
Ci9DQUlRQUNvZENodHljRjlvT2t0TmFua3dVMjFtTmtkQ1dFeFhOek51YmxGRlRsRRAB,5,Luar biasa👍 …Jenis perjalananBisnis… Lainnya
Ci9DQUlRQUNvZENodHljRjlvT2xkcFFrSlBZbmRGYTBocldtSnJXbVJaWkRad1ZHYxAB,4,sejuk dan nyamanKamar: 4Layanan:… Lainnya
Ci9DQUlRQUNvZENodHljRjlvT2xwUWIyeFFVRWRuT1VoWmNVTnZRaTFVZUcxQmVWRRAB,5,ballroomnya okLokasi: 5
Ci9DQUlRQUNvZENodHljRjlvT2s1YWRHaGthbmd0TjJGbFZqQlZOamxRWVZRMk1XYxAB,5,KerenJenis perjalananLiburan… Lainnya
Ci9DQUlRQUNvZENodHljRjlvT2pkNWFFOXJZbGR1WDJaUGVtRk5OVUkxZDNwU1kxRRAB,5,Hotel mewah sangat bagusJenis perjalananBisnis… Lainnya
Ci9DQUlRQUNvZENodHljRjlvT2xWdlNrdHBhRWN0YlZoNlJrdDRZMlI2TjJGUGVtYxAB,5,Saya senang menginap di hotel ini. Wilson Sunarto memberikan pelayanan yang baik.Kamar: 5… Lainnya
Ci9DQUlRQUNvZENodHljRjlvT21Gc1JHSXdNbVp6U0d0M1NIWk9WVEpRZWpWb2RWRRAB,5,wow....spektakulerJenis perjalananLiburan… Lainnya
Ci9DQUlRQUNvZENodHljRjlvT2kxTFVuRlJSR2hmWjNocVVVRlBVR0pmU1dsYVptYxAB,5,"Pengalaman menginap yang benar-benar menyenangkan! Pelayanannya luar biasa, terutama dari Ibu Anggi, sang manajer, yang sangat baik dan sangat membantu. Tim resepsionis juga sangat ramah dan penuh perhatian, yang membuat pengalaman menginap … Lainnya"
Ci9DQUlRQUNvZENodHljRjlvT2pOdk1GSXdWMHd6V0RGUFRqZGtlVzE1YVhKNk9WRRAB,5,Staff nya ramah
Ci9DQUlRQUNvZENodHljRjlvT2xFeWFsVXpUamw0T1RKME5XWXRVa1I2ZVVGSVozYxAB,5,Hotel yang bagus!Jenis perjalananLiburan… Lainnya
Ci9DQUlRQUNvZENodHljRjlvT2pkYWRWaHBhekIyU1ZvNU4yZE1Ta0pCY2xwdlJYYxAB,5,"Ini adalah hotel yang sangat bagus, semuanya seperti yang Anda harapkan untuk harganya .... tidak ada pepaya saat sarapan, salah satu dari kelompok kami sangat menyukai pepaya dan selama sisa perjalanan sangat berisik tentang ini Lainnya"
Ci9DQUlRQUNvZENodHljRjlvT2s1TlZUaHVNWGxmY1V4VFQxWlJSbnBwVDJGNmFrRRAB,5,"Kami beruntung bisa menginap di hotel fantastis ini selama empat malam di bulan September 2025. Saya hanya bisa menemukan satu kata untuk menggambarkannya: ""luar biasa."" Stafnya, tanpa terkecuali, sangat ramah. Jika saya harus menyebutkan … Lainnya"
ChdDSUhNMG9nS0VJQ0FnSURna0l5LWtRRRAB,5,☝️👍🫰 …Kamar: 5Layanan: 5… Lainnya
Ci9DQUlRQUNvZENodHljRjlvT2tWTFMzTklhREo2TVRaWWVtWlJkRWc0VUZGV1dIYxAB,5,Bagus sekaliJenis perjalananLiburan… Lainnya
Ci9DQUlRQUNvZENodHljRjlvT21KQ01tOUtOVGQ2Y21SSFJtSkdMVTluYTBWVFlrRRAB,5,"Saya suka tempat ini karena selalu membawa hal-hal baik. Kenangan indah untuk saya, keluarga, dan almarhum suami saya. Lainnya"
ChdDSUhNMG9nS0VJQ0FnSUNMdkpLSThRRRAB,5,stabilKamar: 5Layanan: 5… Lainnya
